pub_id,doi,isbn,doc_type,pub_year,title,source,volume,issue,pages,openalex_id,editor,location,edition,publisher
1449,NA,NA,Article,2020,Evidence Summary,Noninvasive Positive Pressure Ventilation in the Home (with addendum)[Internet],NA,NA,NA,NA,NA,NA,NA,NA
1450,10.18438/B8DP58,NA,Article,2009,"Female public library patrons value the library for services, programs, and technology",University of Alberta Learning Services,NA,NA,NA,NA,NA,NA,NA,NA
1451,10.18438/B8ZK6K,NA,Article,2013,Formalized curiosity: reflecting on the librarian practitioner-researcher,University of Alberta Learning Services,8,1,NA,NA,NA,NA,NA,NA
1452,10.18438/B8VD0N,NA,Article,2016,Librarian Research: Making it Better?,Evidence Based Library and Information Practice,11,1,NA,NA,NA,NA,NA,NA
1453,10.18438/B8P033,NA,Article,2009,Looking to the literature: Domains to help determine where to look,University of Alberta Learning Services,NA,NA,NA,NA,NA,NA,NA,NA
1454,10.18438/B80C9Z,NA,Article,2016,Looking to the literature: Open access and free sources of LIS evidence,Evidence Based Library and Information Practice,4,3,NA,NA,NA,NA,NA,NA
1455,10.18438/B8SP8T,NA,Article,2016,Matching question types to study designs,Evidence Based Library and Information Practice,11,1(S),NA,NA,NA,NA,NA,NA
1456,10.18438/B8C34Q,NA,Article,2016,Networks: Making Connections and Sharing Information,Evidence Based Library and Information Practice,11,3,NA,NA,NA,NA,NA,NA
1457,10.18438/B82S56,NA,Article,2008,"Post‐Secondary Students Prefer IM to E‐mail for Personal and Social Communication. A review of: Lancaster, Sean, David C. Yen, Albert H. Huang, and Shin‐Yuan Hung.“The …",Evidence Based Library and Information Practice,3,1,NA,NA,NA,NA,NA,NA
1458,10.18438/B8NK75,NA,Article,2010,Public libraries can play an important role in the aftermath of a natural disaster,Evidence Based Library and Information Practice,NA,NA,NA,NA,NA,NA,NA,NA
1459,NA,NA,Article,2008,Public libraries in Canada: an overview,Library Management,NA,NA,NA,NA,NA,NA,NA,NA
1460,10.18438/B8WW5P,NA,Article,2016,Research Grants: Does My Research Need Funding?,Evidence Based Library and Information Practice,11,4,NA,NA,NA,NA,NA,NA
1461,10.18438/B8N37B,NA,Article,2017,Research in Practice: Mythbusting EBLIP,Evidence Based Library and Information Practice,12,2,NA,NA,NA,NA,NA,NA
1462,10.18438/B8KC7G,NA,Article,2016,Research methods: Action research,NA,8,4,NA,NA,NA,NA,NA,NA
1463,10.18438/B8Q31P,NA,Article,2016,Research methods: altmetrics,Evidence Based Library and Information Practice,8,1,NA,NA,NA,NA,NA,NA
1464,10.18438/B80917,NA,Article,2012,Research Methods: Bibliometrics,Evidence Based Library and Information Practice,NA,NA,NA,NA,NA,NA,NA,NA
1465,10.18438/B8CG9D,NA,Article,2016,Research methods: Content analysis,Evidence Based Library and Information Practice,NA,NA,NA,NA,NA,NA,NA,NA
1466,10.18438/B87W5S,NA,Article,2011,"Research Methods: Design, Methods, Case Study… oh my!",Evidence Based Library and Information Practice,6,3,NA,NA,NA,NA,NA,NA
1467,10.18438/B87S64,NA,Article,2012,Research methods: Focus groups,Evidence based library and information practice,NA,NA,NA,NA,NA,NA,NA,NA
1468,10.18438/B89P5B,NA,Article,2012,Research methods: interviews,Evidence Based Library and Information Practice,7,2,NA,NA,NA,NA,NA,NA
1469,10.18438/B8QS53,NA,Article,2016,Research methods: Mixed methods research,Evidence Based Library and Information Practice,11,1(S),NA,NA,NA,NA,NA,NA
1470,10.18438/B8S30X,NA,Article,2014,Research methods: sampling,Evidence based library and information practice,NA,NA,NA,NA,NA,NA,NA,NA
1471,10.18438/B8V31X,NA,Article,2014,Research methods: Scoping studies,Evidence Based Library and Information Practice,9,4,NA,NA,NA,NA,NA,NA
1472,10.18438/B8M324,NA,Article,2013,Research methods: systematic reviews,Evidence Based Library and Information Practice,11,1(S),NA,NA,NA,NA,NA,NA
1473,10.18438/B8T307,NA,Article,2016,Research methods: The most significant change technique,Evidence Based Library and Information Practice,NA,NA,NA,NA,NA,NA,NA,NA
1474,10.18438/B8WW3X,NA,Article,2014,Research methods: triangulation,Evidence based library and information practice,NA,NA,NA,NA,NA,NA,NA,NA
1475,NA,NA,Article,2009,Saskatchewan Libraries are Branching Out at This Year’s Saskatchewan Libraries Conference,SLA Forum,32,1,NA,NA,NA,NA,NA,NA
1476,NA,NA,Article,2010,Something for everyone? A content analysis of provincial library association conference sessions,The Partnership: Provincial and Territorial Library Associations of Canada,NA,NA,NA,NA,NA,NA,NA,NA
1477,10.18438/B8GD07,NA,Report,2009,The 5th international evidence based library and information practice conference (EBLIP5): conference report and reflections,Evidence based library and information practice,4,3,NA,NA,NA,NA,NA,NA
1478,10.18438/B8RS9X,NA,Article,2017,The C-EBLIP Fall Symposium: Librarians as Researchers,Evidence Based Library and Information Practice,NA,NA,NA,NA,NA,NA,NA,NA
1479,NA,NA,Review,2010,The LIS blogosphere contains tags that can be categorized and it disseminates professional content,University of Alberta Learning Services,5,1,NA,NA,NA,NA,NA,NA
1480,10.18438/B86K6R,NA,Article,2015,The Open Access Conundrum,Evidence Based Library and Information Practice,10,3,NA,NA,NA,NA,NA,NA
1481,10.18438/B87H03,NA,Article,2016,The reciprocal benefits of library researcher-in-residence programs,Evidence Based Library and Information Practice,11,2,NA,NA,NA,NA,NA,NA
1482,10.18438/B8BS3X,NA,Article,2007,User studies differ across some disciplines and may not be very effective,University of Alberta Learning Services,2,3,NA,NA,NA,NA,NA,NA
1483,NA,NA,Article,2004,Celiac disease: summary,AHRQ Evidence Report Summaries,NA,NA,NA,NA,NA,NA,NA,NA
1484,NA,NA,Article,2004,Measuring the Quality of Breast Cancer Care in Women: Summary,AHRQ Evidence Report Summaries,NA,NA,NA,NA,NA,NA,NA,NA
1485,10.1186/1471-2288-6-33,NA,Article,2006,An alternative to the hand searching gold standard: validating methodological search filters using relative recall,BMC Medical Research Methodology,NA,NA,NA,NA,NA,NA,NA,NA
1486,NA,NA,Article,2005,Effects of omega-3 fatty acids on eye health Appendix C. Data Assessment and Data Abstraction Forms,Evidence Report/technology Assessment (Summary),NA,NA,NA,NA,NA,NA,NA,NA
1487,NA,NA,Article,2004,Celiac Disease Appendix C. Data Assessment and Data Abstraction Forms,Evidence Report/technology Assessment (Summary),NA,NA,NA,NA,NA,NA,NA,NA
1488,NA,NA,Article,2004,Celiac Disease Appendix H. Biopsy Results,Evidence Report/technology Assessment (Summary),NA,NA,NA,NA,NA,NA,NA,NA
1489,10.1037/e439592005-001,NA,Article,2004,Measuring the Quality of Breast Cancer Care in Women Appendix H. Listing of Reference Standards,Evidence Report/technology Assessment (Summary),NA,NA,NA,NA,NA,NA,NA,NA
1490,NA,NA,Article,2004,Celiac Disease Appendix L. Listing of Excluded Studies,Evidence Report/technology Assessment (Summary),NA,NA,NA,NA,NA,NA,NA,NA
1491,NA,NA,Article,2016,Involving Users in the Library Space Planning: a case study of a branch library in a research university,CALA Occasional Paper Series,NA,NA,NA,NA,NA,NA,NA,NA
1492,10.1186/1471-2288-6-7,NA,Article,2006,Can electronic search engines optimize screening of search results in systematic reviews: an empirical study,BMC Medical Research Methodology,NA,NA,NA,NA,NA,NA,NA,NA
1493,NA,NA,Article,2004,Celiac disease.,Evidence report/technology assessment (Summary),NA,NA,NA,NA,NA,NA,NA,NA
1494,NA,NA,Article,2004,Celiac Disease. Evidence Reports/Technology Assessments,"Agency for Healthcare Research and Quality: Rockville, MD, USA",NA,NA,NA,NA,NA,NA,NA,NA
1495,10.1053/j.gastro.2005.02.019,NA,Article,2005,Consequences of testing for celiac disease,Gastroenterology,NA,NA,NA,NA,NA,NA,NA,NA
1496,10.1016/j.acalib.2009.03.010,NA,Article,2009,Developing a systematic patent search training program,The Journal of Academic Librarianship,NA,NA,NA,NA,NA,NA,NA,NA
1497,NA,NA,Article,2005,Effects of omega-3 fatty acids on eye health,Database of Abstracts of Reviews of Effects (DARE): Quality-assessed Reviews …,NA,NA,NA,NA,NA,NA,NA,NA
1498,NA,NA,Article,2005,Effects of Omega-3 fatty acids on eye health: Summary,AHRQ Evidence Report Summaries,NA,NA,NA,NA,NA,NA,NA,NA
1499,10.1016/j.ophtha.2006.02.043,NA,Review,2006,Efficacy of ω-3 fatty acids in preventing age-related macular degeneration: a systematic review,Ophthalmology,NA,NA,NA,NA,NA,NA,NA,NA
1500,10.1097/01.iae.0000233322.83713.2d,NA,Review,2007,Evidence for the effect of ω-3 fatty acids on progression of age-related macular degeneration: A systematic review,Retina,NA,NA,NA,NA,NA,NA,NA,NA
1501,10.1016/j.ijrobp.2019.06.2393,NA,NA,2019,Factors Affecting Mean Heart Dose in Patients Receiving Breast Radiotherapy from 2011-2018 in a Single Institution,"International Journal of Radiation Oncology, Biology, Physics",NA,NA,NA,NA,NA,NA,NA,NA
1502,10.1038/sj.sc.3101769,NA,Review,2005,Fertility following spinal cord injury: a systematic review,Spinal cord,NA,NA,NA,NA,NA,NA,NA,NA
1503,10.1016/j.ijrobp.2020.07.1135,NA,Review,2020,Heart and Lung Dose Metrics in Radiation Therapy Patients Treated for Synchronous Bilateral Breast Cancer (SBBC): A Decade in Review (2011-2018),"International Journal of Radiation Oncology, Biology, Physics",NA,NA,NA,NA,NA,NA,NA,NA
1504,10.1021/jp205052f,NA,Article,2011,High Rate Electrochemical Capacitors from Three-Dimensional Arrays of Vanadium Nitride Functionalized Carbon Nanotubes,Journal of Physical Chemistry C,3,NA,NA,NA,NA,NA,NA,NA
1505,10.1016/j.wpi.2011.06.002,NA,Article,2011,"Identifying key technologies in Saskatchewan, Canada: Evidence from patent information",World Patent Information,NA,NA,NA,NA,NA,NA,NA,NA
1506,10.29173/istl51,NA,Article,2020,Investigating science researchers’ presence on academic profile websites: A case study of a Canadian research university,NA,NA,NA,NA,NA,NA,NA,NA,NA
1507,NA,NA,Article,2004,Listing of Studies Excluded at Level 2,Measuring the Quality of Breast Cancer Care in Women,NA,NA,NA,NA,NA,NA,NA,NA
1508,10.1038/sj.sc.3101880,NA,Review,2006,Male erectile dysfunction following spinal cord injury: a systematic review,Spinal cord,NA,NA,NA,NA,NA,NA,NA,NA
1509,10.1186/1471-2407-6-291,NA,Review,2006,"Many quality measurements, but few quality measures assessing the quality of breast cancer care in women: a systematic review",BMC cancer,NA,NA,NA,NA,NA,NA,NA,NA
1510,10.1016/j.acalib.2017.06.004,NA,Article,2017,Measuring the impact of gold and green open access,The journal of academic librarianship,43,4,NA,NA,NA,NA,NA,NA
1511,NA,NA,Article,2004,Measuring the quality of breast cancer care in women,Agency for Healthcare Research and Quality (US),NA,NA,NA,NA,NA,NA,NA,NA
1512,10.1186/1471-2288-6-23,NA,Review,2006,Optimizing search strategies to identify randomized controlled trials in MEDLINE,BMC Medical Research Methodology,NA,NA,NA,NA,NA,NA,NA,NA
1513,10.1021/jp104306j,NA,Article,2010,Oxygen Reduction Reaction Activity and Electrochemical Stability of Thin-Film Bilayer Systems of Platinum on Niobium Oxide,Journal of Physical Chemistry C,114,39,NA,NA,NA,NA,NA,NA
1514,10.18438/B85K52,NA,Article,2006,Reporting of the role of the expert searcher in Cochrane Reviews,Evidence based Library and information practice,1,4,NA,NA,NA,NA,NA,NA
1515,NA,NA,Article,2004,Sexuality and Reproductive Health Following Spinal Cord Injury: Summary,AHRQ Evidence Report Summaries,NA,NA,NA,NA,NA,NA,NA,NA
1516,10.1080/0194262X.2022.2049954,NA,Article,2022,STEM Librarians’ Presence on Academic Profile Websites,Science & Technology Libraries,NA,NA,NA,NA,NA,NA,NA,NA
1517,NA,NA,Article,2015,Studying the Publication Pattern of Canadian Computer Scientists/Étude des pratiques de publication des scientifiques canadiens en informatique,Canadian Journal of Information and Library Science,NA,NA,NA,NA,NA,NA,NA,NA
1518,10.1021/jp2049684,NA,Article,2011,Supercapacitive Properties of Hydrothermally Synthesized Co3O4 Nanostructures,Journal of Physical Chemistry C,115,35,NA,NA,NA,NA,NA,NA
1519,10.1053/j.gastro.2005.02.028,NA,Article,2005,The diagnostic accuracy of serologic tests for celiac disease: a systematic review,Gastroenterology,NA,NA,NA,NA,NA,NA,NA,NA
1520,10.1016/j.acalib.2007.03.006,NA,Article,2007,The efficacy of computer-assisted instruction versus face-to-face instruction in academic libraries: A systematic review,The Journal of Academic Librarianship,NA,NA,NA,NA,NA,NA,NA,NA
1521,10.1016/S0008-4182(06)80012-8,NA,Article,2006,The evidence for efficacy of omega-3 fatty acids in preventing or slowing the progression of retinitis pigmentosa: a systematic review,Canadian journal of ophthalmology,41,4,NA,NA,NA,NA,NA,NA
1522,10.29173/istl1596,NA,Article,2014,The impact of data source on the ranking of computer scientists based on citation indicators: A comparison of Web of Science and Scopus,Issues in Science and Technology Librarianship,75,NA,NA,NA,NA,NA,NA,NA
1523,10.1053/j.gastro.2005.02.014,NA,Article,2005,The prevalence of celiac disease in average-risk and at-risk Western European populations: a systematic review,Gastroenterology,128,4,NA,NA,NA,NA,NA,NA
1524,10.1007/s11192-018-2924-2,NA,Article,2018,The prevalence of green and grey open access: Where do physical science researchers archive their publications?,Scientometrics,117,3,NA,NA,NA,NA,NA,NA
1525,NA,NA,NA,2005,My heart has a strange courage: challenging the female life-course in Depression-era Halifax,"Halifax, NS: Saint Mary's University",NA,NA,NA,NA,NA,NA,NA,NA
1526,10.1080/01930826.2010.488961,NA,Article,2010,"Anything, anywhere, anytime: the promise of the ANimated Tutorial Sharing Project for online and mobile information literacy",Journal of Library Administration,NA,NA,NA,NA,NA,NA,NA,NA
1527,NA,NA,Article,2011,"Doing it Right: Collaboration, Shared Workspaces, Syndication and Broadcasting at the ANimated Tutorial Sharing Project",NA,NA,NA,NA,NA,NA,NA,NA,NA
1528,NA,NA,Article,2014,"Environmental scan and assessment of OERs, MOOCs and Libraries",Chicago: Association of College and Research Libraries,NA,NA,NA,NA,NA,NA,NA,NA
1529,NA,978-1-85604-762-3,Book Chapter,2012,"Moving information literacy beyond Library 2.0: multimedia, multi-device, point-of-need screencasts via the ANimated Tutorial Sharing Project",Information Literacy Beyond Library,NA,NA,125-138,NA,NA,NA,NA,NA
1530,NA,NA,Article,2007,Providing Innovative Services to “Our Users” in the World of Web 2.0: The ANTS Initiative,NA,NA,NA,NA,NA,NA,NA,NA,NA
1531,10.21083/partnership.v4i1.941,NA,Book Review,2009,Book Review: Training Paraprofessionals for Reference Service: a How-To-Do-It Manual for Librarians,Partnership: The Canadian Journal of Library and Information Practice and …,NA,NA,NA,NA,NA,NA,NA,NA
1532,10.21083/partnership.v14i1.4767,NA,Article,2019,Going Dark: What Are the Consequences of Losing Off-Campus Access to Library Resources?,Partnership: The Canadian Journal of Library and Information Practice and …,NA,NA,NA,NA,NA,NA,NA,NA
1533,10.21083/partnership.v14i1.4764,NA,Article,2019,Hype or real threat: the extent of predatory journals in student bibliographies,Partnership: The Canadian Journal of Library and Information Practice and …,14,1,NA,NA,NA,NA,NA,NA
1534,10.3390/ijerph16214158,NA,Article,2019,The effectiveness of tobacco dependence education in Health professional Students’ practice: a systematic review and meta-analysis of randomized controlled trials,International journal of environmental research and public health,NA,NA,NA,NA,NA,NA,NA,NA
1535,NA,NA,Article,2009,Training Paraprofessionals for Reference Service: a How-To-Do-It Manual for Librarians®(Number 164),Partnership: the Canadian Journal of Library and Information Practice and …,4,1,NA,NA,NA,NA,NA,NA
1536,https://doi.org/10.1086/adx.23.1.27949280,NA,journal-article,2004,"Cultural Calamities: Damage to Iraq's Museums, Libraries, and Archaeological Sites During the United States-Led War on Iraq",Art Documentation: Journal of the Art Libraries Society of North America,23,1,4-11,https://openalex.org/W2473372121,NA,NA,NA,NA
1537,https://doi.org/10.1086/adx.20.2.27949147,NA,journal-article,2001,"On Collecting and Exhibiting Art Objects in Libraries, Archives, and Research Institutes",Art Documentation: Journal of the Art Libraries Society of North America,20,2,10-15,https://openalex.org/W2223144580,NA,NA,NA,NA
1538,https://doi.org/10.1086/adx.26.2.27949465,NA,journal-article,2007,Subject Headings for Aboriginals: The Power of Naming,Art Documentation: Journal of the Art Libraries Society of North America,26,2,18-22,https://openalex.org/W2506942114,NA,NA,NA,NA
1539,https://doi.org/10.1086/675702,NA,journal-article,2014,"The Tenacious Book, Part 1: The Curious State of Art and Architecture Library Collections in a Digital Era",Art Documentation: Journal of the Art Libraries Society of North America,33,1,2-17,https://openalex.org/W2031268539,NA,NA,NA,NA
1540,https://doi.org/10.1086/675703,NA,journal-article,2014,"The Tenacious Book, Part 2: Publishers’ Views on the Once and Future State of the Art Book",Art Documentation: Journal of the Art Libraries Society of North America,33,1,18-26,https://openalex.org/W2048096141,NA,NA,NA,NA
1541,NA,NA,Article,2019,Copyright Contradictions in Scholarly Publishing,KPU Demonstration Journal,NA,NA,NA,NA,NA,NA,NA,NA
1542,NA,NA,Article,2019,OER Strategic Planning for Libraries,KPU Demonstration Journal,NA,NA,NA,NA,NA,NA,NA,NA
1543,10.14288/1.0107455,NA,Article,2011,Open access up for review: academic attitudes towards open access publishing in relation to tenure and promotion,Open Excess,NA,NA,NA,NA,NA,NA,NA,NA
1544,10.15200/winn.140813.35294,NA,Article,2014,Open Letter to The American Association for the Advancement of Science,The Winnower,NA,NA,NA,NA,NA,NA,NA,NA
1545,NA,NA,Article,2014,Public Knowledge Project: Collaborations & Community Building,NA,NA,NA,NA,NA,NA,NA,NA,NA
1546,NA,NA,Article,2019,Scholarly Associations and the Economic Viability of Open Access Publishing,KPU Demonstration Journal,NA,NA,NA,NA,NA,NA,NA,NA
1547,NA,NA,NA,2013,The public knowledge project: open source-publishing services for your library,"Library Publishing Toolkit, IDS Project Press, Geneseo, New York, NY",NA,NA,NA,NA,NA,NA,NA,NA
1548,10.7939/R3X921W05,NA,Article,2006,Introducing unapi,NA,NA,NA,NA,NA,NA,NA,NA,NA
1549,10.1163/9789004247154_021,NA,Book Chapter,1995,John Bromyard and the Hereford Dominicans,Centres of Learning,NA,NA,255-264,NA,NA,NA,NA,NA
1550,10.1484/j.ms.2.306379,NA,Article,1990,"Medieval Latin Poetic Anthologies (VI): The Cotton anthology of Henry of Avranches (BL Cotton Vespasian DV, fols. 151-184)",Mediaeval Studies,NA,NA,151-184,NA,NA,NA,NA,NA
1551,NA,90-04-10830-0,Conference Proceedings,1997,"Pre-modern encyclopaedic texts: proceedings of the second COMERS Congress, Groningen, 1-4 July 1996",Brill,NA,NA,NA,NA,NA,NA,NA,NA
1552,NA,NA,Book Chapter,1997,Preachers' Responses to Thirteenth-Century Encyclopaedism,Pre-modern encyclopaedic texts,NA,NA,NA,NA,NA,NA,NA,NA
1553,10.2307/43629384,NA,Article,1991,"The date and setting of Michael of Cornwall's"" Versus contra Henricum Abrincensem""",Medium aevum,NA,NA,NA,NA,NA,NA,NA,NA
1554,NA,NA,Thesis,1993,Thirteenth century Latin poetry contests associated with Henry of Avranches with an appendix of newly edited texts.,NA,NA,NA,NA,NA,NA,NA,NA,NA
1555,NA,978-2-503-50478-0,Essay,1996,Tractatus Novarum Decretalium: verses on the Liber Extra,Media Latinitas: a collection of essays to mark the occasion of the …,NA,NA,NA,NA,NA,NA,NA,NA
1556,10.1484/J.MS.2.306470,NA,Article,2000,Two poetic debates by Henry of Avranches,Mediaeval studies,NA,NA,NA,NA,NA,NA,NA,NA
1557,10.7939/R3862BF04,NA,Article,2006,Wikipedia grows up,Feliciter,52,2,59-61,NA,NA,NA,NA,NA
1558,NA,NA,Article,2018,Bringing Women's Studies to Life: Integrating a Human Library into Augustana's Women's Studies Curriculum.,College Quarterly,21,3,NA,NA,NA,NA,NA,NA
1559,NA,NA,Article,2010,Implications of Imitation: Two Postmodern Literary Revisions,Metamorphosis,NA,NA,NA,NA,NA,NA,NA,NA
1560,10.1080/10875301.2019.1643435,NA,Article,2018,Proactive chat in a discovery service: What users are asking,Internet Reference Services Quarterly,23,(3-4),NA,NA,NA,NA,NA,NA
1561,10.1093/pch/19.6.e35-177,NA,Review,2014,181: Screening for Post-Traumatic Stress Disorder After Injury in the Pediatric Emergency Department–A Systematic Review,Paediatrics & Child Health,NA,NA,NA,NA,NA,NA,NA,NA
1562,10.20361/G2Q88Z,NA,Book Review,2015,A Children’s Guide to Arctic Birds by M. Pelletier,The Deakin Review of Children's Literature,NA,NA,NA,NA,NA,NA,NA,NA
1563,10.20361/dr29492,NA,Book Review,2020,A Children’s Guide to Arctic Butterflies by M. Pelletier,The Deakin Review of Children's Literature,NA,NA,NA,NA,NA,NA,NA,NA
1564,10.1080/01639374.2017.1312723,NA,Article,2017,A community-driven metadata framework for describing cultural resources: The Digital Library North project,Cataloging & Classification Quarterly,NA,NA,NA,NA,NA,NA,NA,NA
1565,10.29173/cais1034,NA,Article,2017,A Community-Driven Usability Evaluation: The Case of the Inuvialuit Settlement Region Digital Library,NA,NA,NA,NA,NA,NA,NA,NA,NA
1566,10.5596/c16-003,NA,Review,2016,A curriculum for introductory systematic review searching for researchers,Journal of the Canadian Health Libraries Association/Journal de l …,NA,NA,NA,NA,NA,NA,NA,NA
1567,NA,NA,Article,2017,A Filter to Retrieve Studies Related to Emergency Departments From the EMBASE Database,"John W. Scott Health Sciences Library, University of Alberta Accessed on: Feb",NA,NA,NA,NA,NA,NA,NA,NA
1568,10.7939/R3D21RK9Q,NA,Research Materials,2013,A Filter to Retrieve Studies Related to Saskatchewan Indigenous Peoples in Ovid Medline,NA,NA,NA,NA,NA,NA,NA,NA,NA
1569,10.7939/r3-gtzb-bv33,NA,Research Materials,2019,A Hedge to Retrieve Studies Related to OECD Countries (2019) from the Ovid MEDLINE Database,NA,NA,NA,NA,NA,NA,NA,NA,NA
1570,10.20361/G2BS3T,NA,Research Materials,2012,A House in the Woods by I. Moore,The Deakin Review of Children's Literature,NA,NA,NA,NA,NA,NA,NA,NA
1571,10.3389/fpubh.2022.676704,NA,Review,2022,A qualitative assessment of studies evaluating the classification accuracy of personnel using START in disaster triage: a scoping review,Frontiers in public health,NA,NA,NA,NA,NA,NA,NA,NA
1572,10.1186/s13643-021-01745-y,NA,Review,2021,A scoping review of researchers’ involvement in health policy dialogue in Africa,Systematic Reviews,NA,NA,NA,NA,NA,NA,NA,NA
1573,10.1155/2020/6085368,NA,Review,2020,A scoping review on the attributes of cluster randomized controlled trials in long-term care facilities,Current gerontology and geriatrics research,NA,NA,NA,NA,NA,NA,NA,NA
1574,10.7939/R30844,NA,Research Materials,2014,A Selective Collection of Children’s Health Fiction 2011-2014 Revised October 2014,NA,NA,NA,NA,NA,NA,NA,NA,NA
1575,10.7939/R3VD6P84T,NA,Report,2017,A Selective Collection of Children’s Health Fiction 2014-2016,NA,NA,NA,NA,NA,NA,NA,NA,NA
1576,10.1016/j.ctrv.2017.02.003,NA,Review,2017,A systematic review of smell alterations after radiotherapy for head and neck cancer,Cancer treatment reviews,NA,NA,NA,NA,NA,NA,NA,NA
1577,10.1016/j.ijporl.2016.01.028,NA,Review,2016,A systematic review of the evidence on spontaneous resolution of laryngomalacia and its symptoms,International journal of pediatric otorhinolaryngology,NA,NA,NA,NA,NA,NA,NA,NA
1578,10.20361/G2W30R,NA,Book Review,2012,A Walk on the Tundra by R. Hainnu & A. Ziegler,The Deakin Review of Children's Literature,NA,NA,NA,NA,NA,NA,NA,NA
1579,10.5596/c16-014,NA,Review,2016,Acknowledging librarians’ contributions to systematic review searching,Journal of the Canadian Health Libraries Association/Journal de l …,NA,NA,NA,NA,NA,NA,NA,NA
1580,10.1016/j.ijporl.2014.08.012,NA,Review,2014,Acquired bilateral adductor laryngeal paralysis in neonates and children: a case series and a systematic review,International Journal of Pediatric Otorhinolaryngology,NA,NA,NA,NA,NA,NA,NA,NA
1581,10.1089/neu.2017.5345,NA,Review,2018,Adherence to brain trauma foundation guidelines for management of traumatic brain injury patients and its effect on outcomes: systematic review,Journal of neurotrauma,NA,NA,NA,NA,NA,NA,NA,NA
1582,10.1186/s13643-015-0140-1,NA,Review,2015,Adherence to Brain Trauma Foundation guidelines for management of traumatic brain injury patients: study protocol for a systematic review and meta-analysis,Systematic reviews,NA,NA,NA,NA,NA,NA,NA,NA
1583,10.20361/G2Q02X,NA,Book Review,2017,Akilak’s Adventure by D. Kigjugalik Webster,The Deakin Review of Children's Literature,NA,NA,NA,NA,NA,NA,NA,NA
1584,10.20361/G2B103,NA,Book Review,2018,"Aluniq: and her friend, Buster by A. Pingo",The Deakin Review of Children's Literature,NA,NA,NA,NA,NA,NA,NA,NA
1585,10.1089/jpm.2020.0607,NA,Review,2021,An Assessment of Emergency Department-Based Interventions for Patients with Advanced or End-Stage Illness: A Systematic Review,Journal of palliative medicine,NA,NA,NA,NA,NA,NA,NA,NA
1586,NA,NA,Conference Paper,2011,An Association-Based Continuing Education Certification Program: The Library Association of Alberta Pilot Program,"World Library and Information Conference, San Juan, Puerto Rico",NA,NA,NA,NA,NA,NA,NA,NA
1587,10.29173/cais944,NA,Article,2016,An Emerging Digital Library Platform for Canada’s North.,Proceedings of the Annual Conference of CAIS/Actes du congrès annuel de l'ACSI,NA,NA,NA,NA,NA,NA,NA,NA
1588,NA,NA,Article,NA,Analyzing Published Health Research Related to Indigenous Peoples in Northern Canada: explorations using a sensitive search filter,Papers presented at the,NA,NA,NA,NA,NA,NA,NA,NA
1589,10.20361/G2NM3W,NA,Book Review,2017,Animals Illustrated Series by Inhabit Media,The Deakin Review of Children's Literature,NA,NA,NA,NA,NA,NA,NA,NA
1590,10.4103/2249-4847.165687,NA,Review,2015,Antibiotic administration for prevention or treatment of meconium aspiration syndrome in neonates: A systematic review,Journal of Clinical Neonatology,NA,NA,NA,NA,NA,NA,NA,NA
