pub_id,doi,isbn,doc_type,pub_year,title,source,volume,issue,pages,openalex_id,editor,location,edition,publisher
4007,NA,NA,NA,2012,Safety in homecare-what do we know?: a systematic review,JBI Evidence Implementation,NA,NA,NA,NA,NA,NA,NA,NA
4008,NA,NA,NA,2021,Search is a verb: systematic review searching as invisible labor,Journal of the Medical Library Association: JMLA,NA,NA,NA,NA,NA,NA,NA,NA
4009,10.1139/apnm-2020-0272,NA,Review,2020,Sedentary behaviour and health in adults: an overview of systematic reviews,APPLIED PHYSIOLOGY NUTRITION AND METABOLISM,45,10,S197-S217,NA,NA,NA,NA,NA
4010,NA,NA,NA,2010,Self‐care‐related safety for seniors living at home: a systematic review,The JBI Database of Systematic Reviews and Implementation Reports,NA,NA,NA,NA,NA,NA,NA,NA
4011,NA,NA,NA,2021,Should I include studies from “predatory” journals in a systematic review? Interim guidance for systematic reviewers,JBI evidence synthesis,NA,NA,NA,NA,NA,NA,NA,NA
4012,10.1139/apnm-2020-0034,NA,Review,2020,Sleep duration and health in adults: an overview of systematic reviews,APPLIED PHYSIOLOGY NUTRITION AND METABOLISM,45,10,S218-S231,NA,NA,NA,NA,NA
4013,NA,NA,NA,2022,Sleep timing and health indicators in children and adolescents: a systematic review,"Health Promotion and Chronic Disease Prevention in Canada: Research, Policy …",NA,NA,NA,NA,NA,NA,NA,NA
4014,10.1139/apnm-2020-0032,NA,Review,2020,"Sleep timing, sleep consistency, and health in adults: a systematic review",APPLIED PHYSIOLOGY NUTRITION AND METABOLISM,45,10,S232-S247,NA,NA,NA,NA,NA
4015,NA,NA,NA,2022,"Systematic Review and Meta-analysis on the Incidence, Prevalence and Determinants of Discomfort in Inflammatory Bowel Disease",Journal of the Canadian Association of Gastroenterology,NA,NA,NA,NA,NA,NA,NA,NA
4016,NA,NA,NA,2020,The Effect of Endotracheal Intubation Checklists: A Systematic Review,Chest,NA,NA,NA,NA,NA,NA,NA,NA
4017,NA,NA,NA,2012,"The incidence, prevalence and contributing factors associated with the occurrence of medication errors for children and adults in the community",JBI Evidence Implementation,NA,NA,NA,NA,NA,NA,NA,NA
4018,NA,NA,NA,2012,"The incidence, prevalence and contributing factors associated with the occurrence of medication errors for children and adults in the community setting: A systematic review",JBI Evidence Synthesis,NA,NA,NA,NA,NA,NA,NA,NA
4019,NA,NA,NA,2021,The needs of gynecological cancer survivors at the end of primary treatment: A scoping review and proposed model to guide clinical discussions,Patient Education and Counseling,NA,NA,NA,NA,NA,NA,NA,NA
4020,NA,NA,NA,2022,The Use of Near-Infrared Spectroscopy and/or Transcranial Doppler as Non-Invasive Markers of Cerebral Perfusion in Adult Sepsis Patients With Delirium: A Systematic Review,Journal of intensive care medicine,NA,NA,NA,NA,NA,NA,NA,NA
4021,NA,NA,NA,2009,Theoretical models or frameworks that address the process of synthesis: a scoping review,The JBI Database of Systematic Reviews and Implementation Reports,NA,NA,NA,NA,NA,NA,NA,NA
4022,NA,NA,NA,2006,Third Evidence-Based Librarianship Conference,Journal of Hospital Librarianship,NA,NA,NA,NA,NA,NA,NA,NA
4023,NA,NA,NA,2022,Timing of sedentary behaviour and access to sedentary activities in the bedroom and their association with sleep quality and duration in children and youth: a systematic review,"Health Promotion and Chronic Disease Prevention in Canada: Research, Policy …",NA,NA,NA,NA,NA,NA,NA,NA
4024,NA,NA,NA,2013,Towards a conceptual consensus of continuity in mental healthcare: Focused literature search and theory analysis,International Journal of Evidence‐Based Healthcare,NA,NA,NA,NA,NA,NA,NA,NA
4025,NA,NA,NA,2012,Transforming self-the experience of living with another's heart: A systematic review of qualitative evidence on adult heart transplantation,JBI Evidence Synthesis,NA,NA,NA,NA,NA,NA,NA,NA
4026,NA,NA,NA,2021,Use and effects of implementation strategies for practice guidelines in nursing: a systematic review,Implementation Science,NA,NA,NA,NA,NA,NA,NA,NA
4027,NA,NA,NA,2010,Utilisation of theoretical models and frameworks in the process of evidence synthesis,JBI Evidence Synthesis,NA,NA,NA,NA,NA,NA,NA,NA
4028,NA,NA,NA,2016,Weakness in the evidence base: latent problems to consider and solutions for improvement,Patient Safety,NA,NA,NA,NA,NA,NA,NA,NA
4029,10.1213/ANE.0000000000002705,NA,Review,2018,Bias in Before-After Studies: Narrative Overview for Anesthesiologists,Anesthesia and Analgesia,126,5,1755-1762,NA,NA,NA,NA,NA
4030,NA,NA,journal-article,2008,Book Review: Using Interactive Technologies in Libraries,Library Resources & Technical Services,NA,NA,NA,NA,NA,NA,NA,NA
4031,NA,NA,journal-article,2020,Boredom and homelessness: A scoping review,Journal of Occupational Science,NA,NA,NA,NA,NA,NA,NA,NA
4032,10.1111/hsc.13030,NA,Review,2020,Effectiveness of interventions targeting community integration among individuals with lived experiences of homelessness: A systematic review,Health & Social Care in the Community,28,6,1843-1862,NA,NA,NA,NA,NA
4033,10.5014/ajot.2019.73S1-PO2002,NA,Meeting Abstract,2019,Occupational Experience and Homelessness: A Systematic Review and Meta-Aggregation,American Journal of Occupational Therapy,73,4,NA,NA,NA,NA,NA,NA
4034,10.1080/11038128.2019.1689292,NA,Review,2020,Occupational experiences of homelessness: A systematic review and meta-aggregation,Scandinavian Journal of Occupational Therapy,27,6,394-407,NA,NA,NA,NA,NA
4035,NA,NA,journal-article,2011,"Scary, Exciting or Something In-Between: How Do Next Generation Academic Librarians Perceive Institutional Change?",NA,NA,NA,NA,NA,NA,NA,NA,NA
4036,10.5860/lrts.52n4.264.2,NA,Book Review,2008,Using Interactive Technologies in Libraries,Library Resources & Technical Services,52,4,264,NA,NA,NA,NA,NA
4037,NA,NA,journal-article,2017,A Quest to Survey Library and University Press Collaborations in Canada: A Case Study in Research Approach and Design,NA,NA,NA,NA,NA,NA,NA,NA,NA
4038,NA,NA,dissertation-thesis,2001,An investigation into the non-borrowing use of public library services,"University of Sheffield, Department of Information Studies",NA,NA,NA,NA,NA,NA,NA,NA
4039,NA,NA,journal-article,2020,Another piece of the Zika puzzle: assessing the associated factors to microcephaly in a systematic review and meta-analysis,BMC public health,NA,1,NA,NA,NA,NA,NA,NA
4040,NA,NA,journal-article,2021,Appraisal of multivariable prognostic models for post-operative liver decompensation following partial hepatectomy: a systematic review,HPB,NA,NA,NA,NA,NA,NA,NA,NA
4041,NA,NA,journal-article,2020,Are we family? A scoping review of how military families are defined in mental health and substance use research,"Journal of Military, Veteran and Family Health",NA,NA,NA,NA,NA,NA,NA,NA
4042,10.1016/j.giq.2009.12.004,NA,Article,2010,Can the government really help? Online information for women experiencing violence,Government Information Quarterly,27,2,170-176,NA,NA,NA,NA,NA
4043,NA,NA,journal-article,2020,Characteristics and Effectiveness of dedicated care programs for patients starting dialysis: a systematic review,Kidney,NA,NA,NA,NA,NA,NA,NA,NA
4044,10.1186/s13643-021-01583-y,NA,Article,2021,Considerations for conducting systematic reviews: evaluating the performance of different methods for de-duplicating references,Systematic Reviews,10,1,NA,NA,NA,NA,NA,NA
4045,10.1089/jpm.2020.0060,NA,Review,2020,Continuing Professional Development for Primary Care Providers in Palliative and End-of-Life Care: A Systematic Review,Journal of Palliative Medicine,23,8,1104-1124,NA,NA,NA,NA,NA
4046,NA,NA,journal-article,2021,Editor's Message,Journal of the Canadian Health Libraries Association / Journal de l'Association des bibliothèques de la santé du Canada,NA,NA,NA,NA,NA,NA,NA,NA
4047,NA,NA,journal-article,2021,Embracing the value of research data: introducing the JCHLA/JABSC Data Sharing Policy,Journal of the Canadian Health Libraries Association/Journal de l …,NA,NA,NA,NA,NA,NA,NA,NA
4048,10.1093/humupd/dmaa033,NA,Review,2021,Endometriosis recurrence following post-operative hormonal suppression: a systematic review and meta-analysis,Human Reproduction Update,27,1,96-107,NA,NA,NA,NA,NA
4049,10.5195/jmla.2017.201,NA,Article,2017,Evaluation of hospital staff's perceived quality of librarian-mediated literature searching services,Journal of the Medical Library Association,105,2,120-131,NA,NA,NA,NA,NA
4050,NA,NA,journal-article,2021,Experience of children growing up with a parent who has military-related post-traumatic stress disorder,JBI Evidence Synthesis,NA,NA,NA,NA,NA,NA,NA,NA
4051,NA,NA,journal-article,2018,Experiences of children exposed to parental post-traumatic stress disorder while growing up in military and veteran families,JBI Database of Systematic Reviews and Implementation Reports,NA,NA,NA,NA,NA,NA,NA,NA
4052,NA,NA,NA,2018,Experiences of children exposed to parental post-traumatic stress disorder while growing up in military and veteran families: a systematic review protocol,JBI Evidence Synthesis,NA,NA,NA,NA,NA,NA,NA,NA
4053,NA,NA,journal-article,2018,Humanization of critical care—psychological effects on healthcare professionals and relatives: a systematic review,Canadian Journal of Anesthesia/Journal canadien d'anesthésie,65,12,1348-1371,NA,NA,NA,NA,NA
4054,NA,NA,NA,2009,Is Information Enough? eGovernment and the Information Response for Women Experiencing Domestic Violence,Proceedings of the Annual Conference of CAIS/Actes du congrès annuel de l'ACSI,NA,NA,NA,NA,NA,NA,NA,NA
4055,NA,NA,journal-article,2021,"JCHLA/JABSC editorial policies and practices to address systemic racism and improve equity, diversity, and inclusion",Journal of the Canadian Health Libraries Association/Journal de l …,NA,NA,NA,NA,NA,NA,NA,NA
4056,NA,NA,NA,2019,Long Term Outcomes of Post-Operative Hormonal Suppression in Patients with Endometriosis: A Systematic Review and Meta-Analysis,Journal of Minimally Invasive Gynecology,NA,NA,NA,NA,NA,NA,NA,NA
4057,NA,NA,NA,2019,Mapping Psilocybin-Assisted Therapies: A Scoping Review,medRxiv,NA,NA,NA,NA,NA,NA,NA,NA
4058,NA,NA,journal-article,2020,PRISMA guideline compliance is imperative for systematic review appraisal,Canadian journal of kidney health and disease,NA,NA,NA,NA,NA,NA,NA,NA
4059,NA,NA,journal-article,2021,Systematic review support received and needed by researchers: a survey of libraries supporting Ontario medical schools,Journal of the Canadian Health Libraries Association/Journal de l …,NA,NA,NA,NA,NA,NA,NA,NA
4060,10.3390/nu12102909,NA,Review,2020,Vitamin K Supplementation for the Prevention of Cardiovascular Disease: Where Is the Evidence? A Systematic Review of Controlled Trials,Nutrients,12,10,NA,NA,NA,NA,NA,NA
4061,NA,NA,NA,2019,""" PERFORMANCE OF SOFT CLAY STABILIZATION USING GEOCELLS UNDER SHALLOW FOOTINGS",Engineering Research Journal,NA,NA,NA,NA,NA,NA,NA,NA
4062,NA,NA,NA,2019,A Novel Synthesis Of Fused Pyrazolopyrimidine: Pyrazolo-Triazolo-Pyrimidine For Anticancer Evalution.,INTERNATIONAL JOURNAL OF ADVANCED RESEARCH AND PUBLICATIONS,NA,NA,NA,NA,NA,NA,NA,NA
4063,NA,NA,dissertation-thesis,2012,Collaborative Information Behaviour in Learning Tasks: A Study of Engineering Students,McGill University,NA,NA,NA,NA,NA,NA,NA,NA
4064,NA,NA,NA,2011,Collaborative information behaviour in undergraduate group projects: A study of engineering students,Proceedings of the American Society for Information Science and Technology …,NA,NA,NA,NA,NA,NA,NA,NA
4065,NA,NA,NA,2012,Collaborative Information Behaviour of Engineering Students,Proceedings of the Annual Conference of CAIS/Actes du congrès annuel de l'ACSI,NA,NA,NA,NA,NA,NA,NA,NA
4066,NA,NA,NA,2011,Collaborative information behaviour of engineering students in a senior design group project: A pilot study,NA,NA,NA,NA,NA,NA,NA,NA,NA
4067,NA,NA,NA,2013,Collaborative Information Behaviour of Engineering Students in Group-Based Design Projects,Proceedings of the Canadian Engineering Education Association (CEEA),NA,NA,NA,NA,NA,NA,NA,NA
4068,NA,NA,NA,2010,Do E-books offer Enhanced Learning Experiences for Engineering Students?,Proceedings of the Canadian Engineering Education Association (CEEA),NA,NA,NA,NA,NA,NA,NA,NA
4069,NA,NA,NA,2007,EFFECT OF FLUID VISCOSITY ON CLAY BEHAVIOR,"ASCE V International Symposium on Environmental Hydrology, Cairo",NA,NA,NA,NA,NA,NA,NA,NA
4070,NA,NA,NA,2011,Engineering graduate attribute development (EGAD) project,Proceedings of the Canadian Engineering Education Association (CEEA),NA,NA,NA,NA,NA,NA,NA,NA
4071,NA,NA,NA,2014,Environmental impact assessment of abundant lead landfill on groundwater and soil quality,Int Water Technol J,NA,NA,NA,NA,NA,NA,NA,NA
4072,NA,NA,NA,2001,Experimental evaluation of soil-geotextile interface friction properties.,Journal of Engineering and Applied Science,NA,NA,NA,NA,NA,NA,NA,NA
4073,NA,NA,journal-article,2013,Exploring the Collaborative Information Behaviour of Engineering Students: a Pilot Study Design,Proceedings of the Annual Conference of CAIS/Actes  …,NA,NA,NA,NA,NA,NA,NA,NA
4074,NA,NA,NA,2012,From# tahrir to# occupywallstreet: How Can Information Science Make Sense of Social Media and Protests?,Proceedings of the Annual Conference of CAIS/Actes du congrès annuel de l'ACSI,NA,NA,NA,NA,NA,NA,NA,NA
4075,NA,NA,NA,2016,Geo-Spatial Tool for the Assessment Offshore Pile Driving Noise Effects on Marine Mammals,Egyptian Journal for Engineering Sciences and Technology,NA,NA,NA,NA,NA,NA,NA,NA
4076,NA,NA,NA,2010,"GREENR (Global Reference on the Environment, Energy, and Natural Resources)",Issues in Science and Technology Librarianship,NA,NA,NA,NA,NA,NA,NA,NA
4077,NA,NA,NA,2014,Highland Lake Workshop Conversations about Critical Action,"International Journal of Engineering, Social Justice, and Peace",NA,NA,NA,NA,NA,NA,NA,NA
4078,NA,NA,NA,2011,Information literacy in CEAB's accreditation criteria: the hidden attribute,Canadian Design Engineering Network,NA,NA,NA,NA,NA,NA,NA,NA
4079,NA,NA,journal-article,2011,INFORMATION LITERACY IN CEAB'S ACCREDITATION CRITERIA: THE HIDDEN ATTRIBUTEINFORMATION LITERACY IN CEAB'S ACCREDITATION CRITERIA:,Proceedings of the Canadian Engineering  …,NA,NA,NA,NA,NA,NA,NA,NA
4080,NA,NA,NA,2021,Integrated method for rice cultivation monitoring using Sentinel-2 data and Leaf Area Index,The Egyptian Journal of Remote Sensing and Space Science,NA,NA,NA,NA,NA,NA,NA,NA
4081,NA,NA,NA,2013,Integrating information literacy in the Engineering curriculum: A program approach,Proceedings of the Canadian Engineering Education Association (CEEA),NA,NA,NA,NA,NA,NA,NA,NA
4082,NA,NA,journal-article,2010,International Librarianship: What Can We Do Here in Canada?,Feliciter,NA,NA,NA,NA,NA,NA,NA,NA
4083,NA,NA,NA,2011,Investigating collaborative information behaviour in undergraduate educational setting: A position paper,A paper presented at ASIST,NA,NA,NA,NA,NA,NA,NA,NA
4084,NA,NA,NA,2008,Investigating collaborative information seeking practice of design engineering students,Proceedings of the Canadian Engineering Education Association (CEEA),NA,NA,NA,NA,NA,NA,NA,NA
4085,NA,NA,journal-article,2009,MineWiki: The use of wiki technology as a tool in a senior mine design course,Proceedings of the Canadian Engineering Education Association (CEEA),NA,NA,NA,NA,NA,NA,NA,NA
4086,NA,NA,NA,2009,On the challenges of implementing Library 2.0 services: A (diverse) panel discussion,Proceedings of the American Society for Information Science and Technology …,NA,NA,NA,NA,NA,NA,NA,NA
4087,NA,NA,NA,2008,Re-designing the library for design engineering,Proceedings of the Canadian Engineering Education Association (CEEA),NA,NA,NA,NA,NA,NA,NA,NA
4088,NA,NA,NA,2010,Students’ conceptions of life-long learning: An exploratory study,Proceedings of the Canadian Engineering Education Association (CEEA),NA,NA,NA,NA,NA,NA,NA,NA
4089,NA,NA,journal-article,2009,The Digital Divide and Social Justice,Feliciter,NA,NA,NA,NA,NA,NA,NA,NA
4090,NA,NA,NA,NA,Work In Progress: How Engineering Students Collaboratively Seek Information in a Design Engineering Course?,Canadian Design Engineering Network (CDEN),NA,NA,NA,NA,NA,NA,NA,NA
4091,NA,NA,NA,2009,Work In Progress: How Engineering Students Collaboratively Seek Information in an Engineering Design Course?,Proceedings of the Canadian Engineering Education Association (CEEA),NA,NA,NA,NA,NA,NA,NA,NA
4092,https://doi.org/10.1080/01639370903203234,NA,journal-article,2009,Preparing Catalogers for RDA Training,Cataloging & Classification Quarterly,47,8,691-707,https://openalex.org/W2054440461,NA,NA,NA,NA
4093,NA,NA,NA,2021,A taxonomy of perceptual effects of orchestration related to auditory grouping principles,Manuscript in preparation,NA,NA,NA,NA,NA,NA,NA,NA
4094,NA,NA,conference-paper,2013,Acoustic and musical features of emotional response to orchestral gestures,Proceedings of Meetings on Acoustics ICA,NA,NA,NA,NA,NA,NA,NA,NA
4095,10.1525/MP.2016.34.1.1,NA,journal-article,2016,"Analysis, performance, and tension perception of an unmeasured prelude for harpsichord",Music Perception: An Interdisciplinary Journal,NA,NA,NA,NA,NA,NA,NA,NA
4096,NA,NA,NA,2009,Communicating voice emphasis in harpsichord performance,ESCOM,NA,NA,NA,NA,NA,NA,NA,NA
4097,NA,NA,other,2020,"Dataverse for the Canadian Research Community: Developing reusable and scalable tools for data deposit, curation, and sharing",Zenodo,NA,NA,NA,NA,NA,NA,NA,NA
4098,NA,NA,journal-article,2017,Digital Music Libraries: Librarian Perspectives and the Challenges Ahead,CAML Review/Revue de l'ACBM,NA,NA,NA,NA,NA,NA,NA,NA
4099,10.1177/1029864917704033,NA,Article,2019,Exploring emotional responses to orchestral gestures,Musicae Scientiae,23,1,25-49,NA,NA,NA,NA,NA
4100,NA,NA,NA,2008,Formal structures in the solo keyboard music of JC Bach and their influence on Mozart,NA,NA,NA,NA,NA,NA,NA,NA,NA
4101,NA,NA,NA,2019,Integrating Dataverse and Archivematica for Research Data PreservatIon,iPres,NA,NA,NA,NA,NA,NA,NA,NA
4102,NA,NA,journal-article,2016,Linking melodic expectation to expressive performance timing and perceived musical tension,Journal of Experimental Psychology: Human Perception and Performance,42,4,594-609,NA,NA,NA,NA,NA
4103,NA,NA,book,2017,Musical structure: Sound and timbre,The Routledge companion to music cognition,NA,NA,NA,NA,NA,NA,NA,NA
4104,NA,NA,NA,2016,Orchestral gestures: Music-theoretical perspectives and emotional responses,McGill University (Canada),NA,NA,NA,NA,NA,NA,NA,NA
4105,NA,NA,NA,2018,Perceptual processes in orchestration,The Oxford Handbook of Timbre,NA,NA,NA,NA,NA,NA,NA,NA
4106,NA,NA,NA,NA,Predicting expressive timing and perceived tension in performances of an unmeasured prelude using the IDyOM model,NA,NA,NA,NA,NA,NA,NA,NA,NA
4107,NA,NA,NA,NA,Sound and Timbre,NA,NA,NA,NA,NA,NA,NA,NA,NA
4108,NA,NA,journal-article,2017,Sustainability engineering collection assessment: A mixed-method analysis,Science & Technology Libraries,NA,NA,NA,NA,NA,NA,NA,NA
4109,NA,NA,NA,2011,"Scary, Exciting or Something In-Between: How Do Next Generation Academic Librarians Perceive Institutional Change?",NA,NA,NA,NA,NA,NA,NA,NA,NA
4110,NA,NA,book-chapter,2020,An Overview of the Open Access Movement in Canada,"Open Praxis, Open Access: Digital Scholarship in Action",NA,NA,NA,NA,NA,NA,NA,NA
4111,NA,NA,journal-article,2021,Canadian Collaborations: Library Communications and Advocacy in the time COVID-19,Journal of Copyright in Education & Librarianship,NA,NA,NA,NA,NA,NA,NA,NA
4112,NA,NA,NA,2017,CARL Submission to the Consultation on Options for Reform of the Copyright Board of Canada,CARL: Canadian Association of Research Libraries,NA,NA,NA,NA,NA,NA,NA,NA
4113,NA,NA,journal-article,2022,Controlled Digital Lending of Library Books in Canada,Available at SSRN,NA,NA,NA,NA,NA,NA,NA,NA
4114,NA,NA,NA,2017,Déclaration d’ouverture de l’ABRC à l’ETHI à propos de le droit à l’oubli,CARL: Canadian Association of Research Libraries,NA,NA,NA,NA,NA,NA,NA,NA
4115,NA,NA,journal-article,2017,Digital Copyright Law,Intellectual Property Journal; Scarborough,NA,NA,NA,NA,NA,NA,NA,NA
4116,NA,NA,report,2012,"Digital Locks and Canadian Research Library Collections: Implications for Scholarship,  Accessibility, and  Preservation (CARL Document)",NA,NA,NA,NA,NA,NA,NA,NA,NA
4117,NA,NA,journal-article,2013,"Digital Locks and Canadian Research Library Collections: Implications for Scholarship, Accessibility, and Preservation (Feliciter Summary)",Feliciter,NA,NA,NA,NA,NA,NA,NA,NA
4118,NA,NA,book-chapter,2019,From Fair Dealing to Fair Use: How Universities Have Adapted to the Changing Copyright Landscape in Canada,Copyright Conversations: Rights Literacy in a Digital World,NA,NA,NA,NA,NA,NA,NA,NA
4119,NA,NA,journal-article,2015,Making User Rights Clear: Adding e-Resource License Information in Library Systems,The Code4Lib Journal,NA,NA,NA,NA,NA,NA,NA,NA
4120,NA,NA,journal-article,2013,Shifting Tides: How the Re-emergence of DRM Impacts Libraries,Feliciter,NA,NA,NA,NA,NA,NA,NA,NA
4121,NA,NA,NA,NA,Strengthening Canadian User Rights through Shared Understanding: Adapting the Codes of Best Practices in Fair Use for Canada,Canadian Association of Research Libraries,NA,NA,NA,NA,NA,NA,NA,NA
4122,NA,NA,journal-article,2015,Collaborative Approaches to the Management of Geospatial Data Collections in Canadian Academic Libraries: A Historical Case Study,Journal of Map & Geography Libraries,NA,NA,NA,NA,NA,NA,NA,NA
4123,NA,NA,journal-article,2010,"Geolibraries, a review: the challenge of maintaining an organizational standard alongside the promotion of interoperability and access",Association of Canadian Map Libraries and Archies Bulletin,NA,NA,NA,NA,NA,NA,NA,NA
4124,NA,NA,book-chapter,2015,Visualizing a collection using interactive maps,More Library Mashups: Exploring New Ways to Deliver Library Data,NA,NA,NA,NA,NA,NA,NA,NA
4125,NA,NA,journal-article,2019,An occupational therapist's guide to accessing research,Occupational Therapy Now,NA,NA,NA,NA,NA,NA,NA,NA
4126,NA,NA,book-chapter,2008,Asking clinical questions and searching for the evidence,Evidence-Based Rehabilitation: A Guide to Practice.,NA,NA,NA,NA,NA,NA,NA,NA
4127,NA,NA,NA,NA,Book review... Using PDAs in libraries: a how-to-do-it manual.,NA,NA,NA,NA,NA,NA,NA,NA,NA
4128,NA,NA,conference-paper,2015,Capacity Building in a Bangladeshi Allied Health Library,Journal of the Canadian Health Libraries Association (JCHLA),NA,NA,NA,NA,NA,NA,NA,NA
4129,NA,NA,journal-article,2005,Developing information literacy skills in nursing and rehabilitation therapy students,Journal of the Canadian Health Libraries Association/Journal de l …,NA,NA,NA,NA,NA,NA,NA,NA
4130,NA,NA,NA,2008,In defence of librarian-mediated searching: a skill that supports evidence-based research and practice,International Federation of Library Associations and Institutions (IFLA …,NA,NA,NA,NA,NA,NA,NA,NA
4131,NA,NA,NA,2018,Le libre accès aux données probantes: conseils utiles pour gagner un temps précieux et ressources dans la quête pour fournir des interventions de physiothérapie fondées sur des …,Physiotherapy Canada,NA,NA,NA,NA,NA,NA,NA,NA
4132,10.3138/ptc.70.2.gee,NA,Editorial Material,2018,Open Access to the Evidence: Helpful Hints to Save Valuable Time and Resources in the Quest to Provide Evidence-Informed Physiotherapy Interventions,Physiotherapy Canada,70,2,95-97,NA,NA,NA,NA,NA
4133,NA,NA,NA,2009,Practice guideline dissemination and implementation strategies for healthcare teams and team-based practice: a systematic review,JBI Evidence Synthesis,NA,NA,NA,NA,NA,NA,NA,NA
4134,NA,NA,journal-article,2009,Practice Guideline Dissemination and Implementation Strategies for Healthcare Teams and Team-Based Practice: a systematic review,JBI Database of Systematic Reviews and Implementation Reports,NA,NA,NA,NA,NA,NA,NA,NA
4135,NA,NA,journal-article,2010,Systematic review of practice guideline dissemination and implementation strategies for healthcare teams and team‐based practice,International Journal of Evidence‐Based Healthcare,NA,NA,NA,NA,NA,NA,NA,NA
4136,NA,NA,journal-article,2006,Using PDAs in libraries: a how-to-do-it manual,Journal of the Canadian Health Libraries Association/Journal de l …,NA,NA,NA,NA,NA,NA,NA,NA
4137,10.5703/1288284315642,NA,Proceedings Paper,2014,Metadata Challenges in Library Discovery Systems,CHARLESTON CONFERENCE PROCEEDINGS 2014: THE IMPORTANCE OF BEING EARNEST,NA,NA,533-540,NA,NA,NA,NA,NA
4138,https://doi.org/10.1108/07378830810857780,NA,journal-article,2008,Using Google Maps as an interface for the library catalogue,Library Hi Tech,26,1,33-40,https://openalex.org/W2004761707,NA,NA,NA,NA
4139,NA,NA,conference-paper,2017,Challenges in the Monetary Appraisal of Digital Archives,"Archives, disrupted (Association of Canadian Archivists)",NA,NA,NA,NA,NA,NA,NA,NA
4140,NA,NA,journal-article,2009,Stones: Using Mashups to Understand a City’s Social Tapestry,The Interactive Archivist: Case Studies in Utilizing Web 2.0 to Improve the Archival Experience,NA,NA,NA,NA,NA,NA,NA,NA
4141,NA,NA,journal-article,2013,The Procrustean Bed: A History of the Arrangement of the Al Purdy Fonds,Archivaria,NA,NA,NA,NA,NA,NA,NA,NA
4142,NA,NA,NA,2002,""" We don't know the first thing about digitization:"" Assessing the Need for Digitization Training in Illinois",RLG DigiNews,NA,NA,NA,NA,NA,NA,NA,NA
4143,NA,NA,journal-article,1993,A manifesto ‐ regarding the future of transaction log analysis,Library Hi Tech,NA,NA,NA,NA,NA,NA,NA,NA
4144,NA,NA,NA,1990,A Model for Teaching and Learning,Convergence: Proceedings of the Second National Conference of the Library …,NA,NA,NA,NA,NA,NA,NA,NA
4145,NA,NA,journal-article,1993,An introduction to the special section on transaction log analysis,Library Hi Tech,NA,NA,NA,NA,NA,NA,NA,NA
4146,NA,NA,journal-article,1993,Applying the results of transaction log analysis,Library Hi Tech,NA,NA,NA,NA,NA,NA,NA,NA
4147,NA,NA,journal-article,2015,Assessing the library's grants program,Evidence Based Library and Information Practice,NA,NA,NA,NA,NA,NA,NA,NA
