pub_id,doi,isbn,doc_type,pub_year,title,source,volume,issue,pages,openalex_id,editor,location,edition,publisher
1,10.18438/B8CW4N,NA,Article,2017,A Comparison of Traditional Book Reviews and Amazon. com Book Reviews of Fiction Using a Content Analysis Approach,Evidence Based Library and Information Practice,12,1,85-96,NA,NA,NA,NA,NA
2,10.21083/partnership.v13i1.4063,NA,Article,2018,Collaboratively creating a programmatic information literacy strategy: Challenges and opportunities,Partnership: The Canadian Journal of Library and Information Practice and …,13,1,NA,NA,NA,NA,NA,NA
3,NA,NA,Presentation,2010,Embedded Information Literacy: An Arts and Humanities Model,NA,NA,NA,NA,NA,NA,NA,NA,NA
4,NA,NA,Presentation,2018,Evidence-based IL program proposals: Engaging in curriculum mapping to re-envision instructional practice,NA,NA,NA,NA,NA,NA,NA,NA,NA
5,10.1002/bult.2006.1720320410,NA,Article,2006,From game studies to bibliographic gaming: Libraries tap into the video game culture,Bulletin of the American Society for Information Science and Technology,32,4,24-26,NA,NA,NA,NA,NA
6,NA,NA,Presentation,2017,Our difference is our strength: Collaboration and creativity in co-creating system wide information literacy learning outcomes,NA,NA,NA,NA,NA,NA,NA,NA,NA
7,NA,NA,Presentation,2018,Stories of Active Teaching: Embedding Civic Engagement in our Practice,NA,NA,NA,NA,NA,NA,NA,NA,NA
8,10.1002/asi.20154,NA,Article,2005,Comparing faculty information seeking in teaching and research: Implications for the design of digital libraries,Journal of the American Society for Information Science and Technology,56,NA,636-657,NA,NA,NA,NA,NA
9,10.5860/crln.66.1.7367,NA,Article,2005,Considering RFID,College & research libraries news,66,1,13-42,NA,NA,NA,NA,NA
10,10.1145/996350.996361,NA,Article,2004,Developing a digital learning environment: an evaluation of design and implementation processes,Proceedings of the 2004 Joint ACM/IEEE Conference on Digital Libraries,NA,NA,37-46,NA,NA,NA,NA,NA
11,NA,NA,Article,2002,Digital libraries as instructional aids for knowledge construction,Educational Technology,42,6,38-42,NA,NA,NA,NA,NA
12,NA,NA,Article,2002,Evaluating a digital library for undergraduate education: A case study of the Alexandria Digital Earth Prototype (ADEPT),Fourth DELOS Workshop. Evaluation of Digital Libraries: Testbeds …,NA,NA,NA,NA,NA,NA,NA,NA
13,NA,NA,Article,2004,Getting ready for class: The information seeking behavior of geography professors in support of teaching,"Annual Meeting of the American Educational Research Association, San Diego, CA",NA,NA,NA,NA,NA,NA,NA,NA
14,10.1145/996350.996390,NA,Article,2004,How geography professors select materials for classroom lectures: implications for the design of digital libraries,Proceedings of the 2004 Joint CM/IEEE Conference on Digital Libraries,NA,NA,179-185,NA,NA,NA,NA,NA
15,NA,NA,Article,2003,Information behavior in support of instruction: Designing the ADEPT digital library to support dual work-roles of academic geographers,NA,NA,NA,NA,NA,NA,NA,NA,NA
16,NA,NA,Article,2004,Making sense of RFID,Library Journal,129,NA,4-14,NA,NA,NA,NA,NA
17,NA,NA,Article,2004,NET CONNECT--LINKONG LIBRARIAN & THE INTERNET--The RFID Riddle PROS & CONS-MAKING SENSE OF RFID-Laura Smart tackles the pros and cons of RFID and offers tools for librarians in …,Library Journal,26,NA,4-16,NA,NA,NA,NA,NA
18,NA,NA,Article,2004,NET CONNECT--LINKONG LIBRARIAN & THE INTERNET--The RFID Riddle PROS & CONS-THE MARKETPLACE-Laura Smart compares the vendors offering RFID solutions,Library Journal,26,NA,17-22,NA,NA,NA,NA,NA
19,NA,NA,Article,2002,"OAIS, METS, MPEG-21, and archival values",The Moving Image: The Journal of the Association of Moving Image Archivists …,2,1,107-129,NA,NA,NA,NA,NA
20,NA,NA,Article,2002,"Structured models of scientific concepts for organizing, accessing, and using learning materials",International Conference on Digital Libraries: Proceedings of the 2nd ACM/IEEE-CS joint conference on Digital libraries,14,18,407,NA,NA,NA,NA,NA
21,NA,NA,Article,2002,The organization of knowledge spaces for a virtual learning environment supported by a digital library,"Digital Libraries: Advanced Methods and Technologies, Digital Collections …",1,NA,53-64,NA,NA,NA,NA,NA
22,10.1002/meet.1450400149,NA,Article,2003,Use scenarios in the development of the Alexandria Digital Earth Prototype (ADEPT),Proceedings of the American Society for Information Science and Technology …,40,1,407-415,NA,NA,NA,NA,NA
23,NA,NA,Article,2004,A reference model for providing statistical consulting services in an academic library setting,IASSIST Quarterly,28,2,35-38,NA,NA,NA,NA,NA
24,NA,NA,Presentation,2012,Bringing them in: what 5 years of data can tell us about growing a data service.,IASSIST Conference,NA,NA,NA,NA,NA,NA,NA,NA
25,NA,NA,Presentation,2010,Data in Development.,IASSIST,NA,NA,NA,NA,NA,NA,NA,NA
26,NA,NA,Article,2010,Data in Development: An Overview of Microdata on Developing Countries,IASSIST Quarterly,34,1,25-30,NA,NA,NA,NA,NA
27,10.21083/partnership.v16i1.6462,NA,Article,2021,Data in the Time of COVID-19: How Data Library Professionals Helped Combat the Pandemic,Partnership: Canadian journal of library and information practice and research/Partnership: revue canadienne de la pratique et de la recherche en bibliothéconomie et sciences de l’information,16,1,44567,NA,NA,NA,NA,NA
28,NA,NA,Article,2016,Databrarianship: The academic data librarian in theory and practice,"Association of College and Research Libraries, a division of the American …",NA,NA,NA,NA,NA,NA,NA,NA
29,10.5281/zenodo.4042023,NA,Article,2020,De-identification Guidance,Portage,NA,NA,NA,NA,NA,NA,NA,NA
30,NA,NA,Presentation,2005,Demystifying data reference.,IASSIST Conference,NA,NA,NA,NA,NA,NA,NA,NA
31,10.5281/zenodo.4453504,NA,Article,2020,Dépôts recommandés pour les données de recherche sur la COVID-19,Portage,NA,NA,NA,NA,NA,NA,NA,NA
32,10.5281/zenodo.4452825,NA,Article,2020,Directives sur la dépersonnalisation des données,Portage,NA,NA,NA,NA,NA,NA,NA,NA
33,NA,NA,Article,2017,Documentation as Data Rescue: Restoring a Collection of Canadian Health Survey Files,Against The Grain,29,6,33,NA,NA,NA,NA,NA
34,10.1080/17430437.2013.838353,NA,Article,2014,Finding strength (s): insights on Aboriginal physical cultural practices in Canada,Sport in Society,17,8,1046-1060,NA,NA,NA,NA,NA
35,NA,9781315724324,Article,2017,Finding strength (s): insights on Aboriginal physical cultural practices in Canada,"Sport, Race and Ethnicity: The Scope of Belonging?",NA,NA,66-80,NA,NA,NA,NA,NA
36,NA,NA,Article,2017,Groupe d’experts sur la découverte des données–Groupe de travail sur le développement des collections: rapport de la phase 1,Portage,NA,NA,NA,NA,NA,NA,NA,NA
37,NA,NA,Article,2020,Guide sur le partage et le dépôt rapide des données sur la COVID-19 pour les chercheurs canadiens,Portage,NA,NA,NA,NA,NA,NA,NA,NA
38,10.5281/zenodo.4042030,NA,Article,2020,Guide to COVID-19 Rapid Response Data Sharing and Deposit for Canadian Researchers,Portage,NA,NA,NA,NA,NA,NA,NA,NA
39,10.1007/s10826-013-9890-3,NA,Article,2015,Intergenerational Transmission of Antisocial Behavior and Age at Primiparity,Journal of Child and Family Studies,24,3,798-808,NA,NA,NA,NA,NA
40,10.23974/ijol.2017.vol2.1.38,NA,Introduction,2017,Introducing this Special Issue on Data Librarianship,International Journal of Librarianship,2,1,44563,NA,NA,NA,NA,NA
41,10.5860/crl.78.3.16597,978-083898799-5,Introduction,2016,Introduction to Databrarianship: The Academic Data Librarian in Theory and Practice,University of Windsor,NA,NA,NA,NA,NA,NA,NA,NA
42,10.23974/ijol.2017.vol2.1.35,NA,Commentary,2017,"Lives in Data: Prominent Data Librarians, Archivists and Educators Share Their Thoughts",International Journal of Librarianship,2,1,66-72,NA,NA,NA,NA,NA
43,10.29173/iq979,NA,Article,2020,"Mathematics, risk, and messy survey data",IASSIST Quarterly,44,4,NA,NA,NA,NA,NA,NA
44,10.14288/1.0351978,NA,Article,2017,Portage Data Discovery Expert Group-Collections Development Working Group: Phase One Report,University of British Columbia,NA,NA,NA,NA,NA,NA,NA,NA
45,NA,NA,Article,2020,Recommended Repositories for COVID-19 Research Data,NA,NA,NA,NA,NA,NA,NA,NA,NA
46,10.23974/ijol.2017.vol2.1.32,NA,Article,2017,The Development of Academic Data Services in Canada and China: Profiles of Data Services at Fudan University and the University of Windsor.,International Journal of Librarianship,2,1,73-78,NA,NA,NA,NA,NA
47,NA,NA,Article,2009,Torturing Nurses With Data: Building a Successful Quantitative Research Module,IASSIST Quarterly,33,3,44721,NA,NA,NA,NA,NA
48,10.1016/j.apmr.2018.12.029,NA,Review,2019,Clinical Determinants of Fitness to Drive in Persons With Multiple Sclerosis: Systematic Review,Archives of Physical Medicine and Rehabilitation,100,8,1534-1555,NA,NA,NA,NA,NA
49,10.1016/j.aap.2019.07.010,NA,Review,2020,Insufficient sleep and fitness to drive in shift workers: A systematic literature review,Accident Analysis and Prevention,134,NA,NA,NA,NA,NA,NA,NA
50,10.1136/injuryprev-2018-042972,NA,Review,2019,Insufficient sleep and fitness to drive in shift workers: a systematic literature review protocol,Injury Prevention,25,6,589-594,NA,NA,NA,NA,NA
51,10.5014/ajot.2019.73S1-PO7023,NA,Meeting Abstract,2019,Systematic Literature Review of Insufficient Sleep and Fitness To Drive in Shift Workers,American Journal of Occupational Therapy,73,4,NA,NA,NA,NA,NA,NA
52,10.5703/1288284316444,NA,Proceedings Paper,2016,"The Librarian's Survival Guide to the ""Big Deal"": Tools for Unbundling",Charleston Conference Proceedings,NA,NA,202-208,NA,NA,NA,NA,NA
53,10.1016/j.acalib.2012.09.016,NA,Article,2013,Undergraduate Program Review Processes: A Case Study in Opportunity for Academic Libraries,Journal of Academic Librarianship,39,2,169-174,NA,NA,NA,NA,NA
54,10.21083/partnership.v7i2.1997,NA,Article,2012,Canadian Academic Library Support for International Faculty: Library Experience and Information Needs of Chinese Visiting Scholars at the University of Western Ontario,Partnership: The Canadian Journal of Library and Information Practice and …,7,2,NA,NA,NA,NA,NA,NA
55,NA,NA,Review,2017,Information Literacy Instruction in Canadian Undergraduate Science Education 2000-2015: A Literature Review,Canadian Journal of Information and Library Science-revue Canadienne Des Sciences De L Information Et De Bibliotheconomie,41,4,263-284,NA,NA,NA,NA,NA
56,10.5860/crl.76.7.934,NA,Article,2015,Integrating Library Instruction into the Course Management System for a First-Year Engineering Class: An Evidence-Based Study Measuring the Effectiveness of Blended Learning on Students' Information Literacy Levels,College & Research Libraries,76,7,934-958,NA,NA,NA,NA,NA
57,10.5062/F4KK9928,NA,Article,2017,Standards Collection Development and Management in an Academic Library: A Case Study at The University of Western Ontario Libraries,Issues in Science and Technology Librarianship,NA,NA,NA,NA,NA,NA,NA,NA
58,10.1108/DLP-06-2020-0054,NA,Article,2020,A bibliography of Canadian Inuit periodicals: a case study in Omeka. net migration,Digital Library Perspectives,38,2,135-145,NA,NA,NA,NA,NA
59,NA,978-2-7605-3151-2,Book,2011,Bibliography of Canadian Inuit Periodicals,PUQ,NA,NA,NA,NA,NA,NA,NA,NA
60,10.1515/9783598441264,NA,Article,2008,"CANADIAN INUIT NEWSPAPERS AND PERIODICALS: PAST, PRESENT & FUTURE",IFLA publications,135,NA,171-184,NA,NA,NA,NA,NA
61,NA,NA,Article,2015,Curating exhibitions in academic libraries: Practical steps,SLA: Special Libraries Association,5,2,44583,NA,NA,NA,NA,NA
62,10.1080/10588167.2018.1453177,NA,Article,2018,Preserving and sharing the popular music of the past: A case study in conservation of a nineteenth-century sheet music collection,Routledge,21,3,122-143,NA,NA,NA,NA,NA
63,10.1108/OCLC-07-2014-0030,NA,Article,2015,The McGill library chapbook project: a case study in TEI encoding,OCLC Systems & Services: International digital library perspectives,31,3,NA,NA,NA,NA,NA,NA
64,NA,9780982170366,Book,2010,The Moravian Beginnings of Canadian Inuit Literature,McGill University Library,NA,NA,NA,NA,NA,NA,NA,NA
65,NA,NA,Book,2008,The Moravian Beginnings of Canadian Inuit Literature. Les origines moraves de la littérature inuite au Canada. Morâviamut Pigianningit Canadamiut Inungit Allaliginniginni,McGill University Library et Imaginaire Nord,NA,NA,NA,NA,NA,NA,NA,NA
66,10.1108/OCLC-07-2014-0030,NA,Article,2018,Touch tables for special collections libraries: curators creating user experiences,NA,NA,NA,NA,NA,NA,NA,NA,NA
67,NA,NA,NA,2019,"A Desperate Measure for Desperate Times: Wooden Shipbuilding in Fort William, 1917-1918",Thunder Bay Historical Museum Society Papers & Records,47,NA,36-62,NA,NA,NA,NA,NA
68,10.25071/2561-5467.232,NA,Article,2016,"Admiralty Orders for Canadian Shipyards:  Trawlers, Drifters, and the Urgency of Coastal Defence during the Great War",The Northern Mariner/Le marin du nord,26,3,275-298,NA,NA,NA,NA,NA
69,NA,NA,Article,1993,Finding Aids and Photographs: A Case Study in the Use of Analog Optical Disc Technology to Improve Access to Historical Images,Archivaria,36,NA,74-86,NA,NA,NA,NA,NA
70,NA,NA,NA,2011,From Feast to Famine: Shipbuilding and the 1912 Waterfront Development Plan,Reshaping Toronto’s Waterfront,NA,NA,97-122,NA,NA,NA,NA,NA
71,10.3138/jsp.37.1.19,NA,Article,2005,Halted by the archive: the impact of excessive archival restrictions on scholars,Journal of Scholarly Publishing,37,1,19-32,NA,NA,NA,NA,NA
72,NA,NA,NA,2011,"Planning for Change: Harbour Commissions, Civil Engineers, and Large-Scale Manipulation of Nature",Reshaping Toronto’s Waterfront,NA,NA,NA,NA,NA,NA,NA,NA
73,NA,NA,Article,1983,Scottish manuscripts in canadian repositories,Archivaria,NA,NA,145-161,NA,NA,NA,NA,NA
74,NA,NA,Article,2017,The Imperial Munitions Board and Merchant Shipbuilding in Canada,Turning Point,NA,NA,51-77,NA,NA,NA,NA,NA
75,doi.org/10.7202/1017657ar,NA,Article,1988,The Toronto Harbour Commission Archives,Urban History Review,17,2,112-115,NA,NA,NA,NA,NA
76,10.1007/BF02770398,NA,Article,1992,The use of optical disc technology to improve access to historical photographs,Archives and Museum Informatics,6,1,44693,NA,NA,NA,NA,NA
77,NA,NA,Article,1989,"Toronto's Waterfront at War, 1914–1918",Archivaria,NA,28,126-140,NA,NA,NA,NA,NA
78,10.5860/crl.77.5.673,NA,Book Review,2016,"Academic E-Books: Publishers, Librarians, and Users.",College & Research Libraries,77,5,673-675,NA,NA,NA,NA,NA
79,10.25071/10315/35711,NA,Dataset,2019,Dataset: The Accessible Content Provider Landscape for Higher Education in North America,NA,NA,NA,NA,NA,NA,NA,NA,NA
80,NA,NA,Dataset,2018,Dataset: York University Libraries Open Access Author Fund,NA,NA,NA,NA,NA,NA,NA,NA,NA
81,10.5860/crl.78.7.1005,NA,Book Review,2017,Developing Digital Scholarship: Emerging Practices in Academic Libraries.,College & Research Libraries,78,7,1004-1006,NA,NA,NA,NA,NA
82,NA,NA,Report,2019,Digital Preservation Functionality in Canadian Repositories,Canadian Association of Research Libraries,NA,NA,NA,NA,NA,NA,NA,NA
83,NA,NA,Conference Presentation,2013,Fair use: a case study in normalizing journal usage data,PKP Scholarly Publishing Conference,NA,NA,NA,NA,NA,NA,NA,NA
84,NA,NA,Article,2019,"Getting Found, Staying Found, Increasing Impact: Enhancing Readership and Preserving Content for OJS Journals",Public Knowledge Project,NA,NA,NA,NA,NA,NA,NA,NA
85,10.5860/crl.76.6.849,NA,Book Review,2015,Getting the Word Out: Academic Libraries as Scholarly Publishers. Eds. Maria Bonn and Mike Furlough for the Association of College and Research Libraries. Chicago: American …,College & Research Libraries,77,7,848-850,NA,NA,NA,NA,NA
86,NA,NA,Conference Poster,2015,Has the# YorkU STEM community embraced Open Access?,NA,NA,NA,NA,NA,NA,NA,NA,NA
87,10.5860/crl.77.4.557,NA,Book Review,2016,"Is Digital Different? How Information Creation, Capture, Preservation and Discovery Are Being Transformed. Michael Moss, Barbara Endicott-Popovsky, and Marc J. Dupuis, eds …",College & Research Libraries,78,5,556-558,NA,NA,NA,NA,NA
88,10.1016/j.serrev.2011.06.005,NA,Editorial Material,2011,Libraries as journal publishers,Serials Review,36,2,196-203,NA,NA,NA,NA,NA
89,NA,NA,Powerpoint Presentation,2011,Modeling Scholarly Communication as an Information System,NA,NA,NA,NA,NA,NA,NA,NA,NA
90,NA,NA,Conference Presentation,2015,Random or reasoned? Design and the scholarly journal article,PKP Scholarly Publishing Conference,NA,NA,NA,NA,NA,NA,NA,NA
91,NA,NA,Book Review,2014,"Robert Spoo. Without Copyrights: Piracy, Publishing, and the Public Domain",College & Research Libraries,75,5,755-757,NA,NA,NA,NA,NA
92,10.5860/crl.80.1.143,NA,Book Review,2019,"Robin Rice and John Southall. The Data Librarian’s Handbook. London: Facet Publishing, 2017. 192p. Paper, $79.99 (ISBN: 978-1-78330-047-1).",College & Research Libraries,80,1,143,NA,NA,NA,NA,NA
93,10.5860/crl.81.6.1051,NA,Book Review,2020,"Sustaining and Enhancing the Scholarly Communications Department: A Comprehensive Guide. Kris S. Helge, Ahmet Meti Tmava, and Amanda R. Zerangue. Santa Barbara, CA: ABC-CLIO …",College & Research Libraries,81,6,1051-1054,NA,NA,NA,NA,NA
94,NA,NA,Conference Poster,2014,The Churchill community of knowledge: An open access digital archive,NA,NA,NA,NA,NA,NA,NA,NA,NA
95,NA,NA,Book Review,2019,The Data Librarian's Handbook,College & Research Libraries,80,1,143-144,NA,NA,NA,NA,NA
96,NA,NA,Conference Presentation,2017,The library publishing landscape: how we define and situate ourselves,PKP,NA,NA,NA,NA,NA,NA,NA,NA
97,10.5860/crl-36r1,NA,Article,2010,The York Digital Journals Project: Strategies for institutional open journal systems implementations,College & research libraries,71,4,310-321,NA,NA,NA,NA,NA
98,NA,NA,Exercise,2014,What would the cost of your last term paper be without library access?,NA,NA,NA,NA,NA,NA,NA,NA,NA
99,10.7710/2162-3309.2209,NA,Article,2018,What’s in a Name? Exploring identity in the field of library journal publishing,Journal of Librarianship and Scholarly Communication,6,1,NA,NA,NA,NA,NA,NA
100,NA,NA,Conference Presentation,2015,What's in a Name? Self-Identifying as a Publisher or Host,PKP Scholarly Publishing Conference,NA,NA,NA,NA,NA,NA,NA,NA
101,10.22230/src.2010v1n1a18,NA,Article,2010,"Who knows what, when? Current and desired capacities for online journal statistics gathering and dissemination",Scholarly and Research Communication,1,1,NA,NA,NA,NA,NA,NA
102,10.1080/19386389.2016.1258891,NA,Article,2016,A Scenes Approach to Metadata Models for Music,Journal of Library Metadata,16,3-4,181-201,NA,NA,NA,NA,NA
103,NA,NA,NA,NA,Academic Reference Librarians• ARTICLE,NA,NA,NA,NA,NA,NA,NA,NA,NA
104,NA,NA,Article,2020,"Bodies, brains, and machines: An exploration of the relationship between the material and affective states of librarians and information systems",library trends,67,2,409-429,NA,NA,NA,NA,NA
105,NA,NA,Conference Presentation,NA,DH2015 Abstract,NA,NA,NA,NA,NA,NA,NA,NA,NA
106,10.25071/1708-6701.1316,NA,Book Review,2006,Frank Welsman: Canadian Conductor (Book Review),CAML Review/Revue de l'ACBM,NA,NA,NA,NA,NA,NA,NA,NA
107,10.1016/j.acalib.2006.07.001,NA,Article,2006,Investigating the value of scholarly book reviews for the work of academic reference librarians,The Journal of academic librarianship,32,5,452-466,NA,NA,NA,NA,NA
108,10.25071/10315/38038,NA,Article,2020,Perspectives on Openness: Honouring Indigenous Ways of Knowing,NA,NA,NA,NA,NA,NA,NA,NA,NA
109,NA,NA,Report,2007,Scholr 2.0: a white paper by Scholars Portage,NA,NA,NA,NA,NA,NA,NA,NA,NA
110,NA,NA,Article,2006,Summer Doldrums and Busy Beavers,NA,NA,NA,NA,NA,NA,NA,NA,NA
111,NA,NA,Article,2005,The Canadian Music Centre and the Digital Delivery of Scores,CAML Review/Revue de l'ACBM,NA,NA,NA,NA,NA,NA,NA,NA
112,NA,NA,Conference Summary,2008,The One Big Library Unconference,Ontario Library Association,NA,NA,NA,NA,NA,NA,NA,NA
113,10.1080/19386389.2012.700606,NA,Article,2012,The possibility of the infinite library: Exploring the conceptual boundaries of works and texts of bibliographic description,Journal of Library Metadata,12,44595,294-309,NA,NA,NA,NA,NA
114,NA,NA,Book Chapter,2017,The Possibility of the Infinite Library: Exploring the Conceptual Boundaries of Works and Texts of Bibliographic Description,Functional Future for Bibliographic Control: Transitioning into new …,NA,NA,NA,NA,NA,NA,NA,NA
115,NA,1550226649,Book Review,2005,Traveling Music: Playing Back the Soundtrack to My Life and Times (Book Review),CAML Review/Revue de l'ACBM,NA,NA,NA,NA,NA,NA,NA,NA
116,NA,NA,Article,2018,Wikidata: a platform for your library’s linked open data,Code4Lib Journal,NA,40,NA,NA,NA,NA,NA,NA
117,10.1353/utq.2012.0129,NA,Book Review,2012,"Shouting, Embracing, and Dancing with Ecstasy: The Growth of Methodism in Newfoundland, 1774-1874",University of Toronto Quarterly,81,3,693-694,NA,NA,NA,NA,NA
118,10.1353/lib.2016.0014,NA,Article,2016,"Affective Labor, Resistance, and the Academic Librarian",Library Trends,65,5,645-667,NA,NA,NA,NA,NA
119,NA,NA,Book Review,2016,"Basements and Attics, Closets and Cyberspace: Explorations in Canadian Women's Archives. Review by Lisa Sloniowski",Resources for Feminist Research Journal/Revue de documentation sur la …,34,3-4,NA,NA,NA,NA,NA,NA
120,NA,NA,Conference Presentation,2013,Grinding the gears: Academic librarians and civic responsibility,Urban Library Journal,19,1,14,NA,NA,NA,NA,NA
121,NA,NA,NA,2013,In the stacks of Barbara Godard or do not confuse the complexity of this moment with chaos,Wilfred Laurier University Press,NA,NA,NA,NA,NA,NA,NA,NA
122,NA,NA,Article,2003,Iraq 2003--Sources of News,University of Windsor: Leddy Library,NA,NA,NA,NA,NA,NA,NA,NA
123,NA,NA,Article,2018,Ordering things,Library Juice Press,NA,NA,NA,NA,NA,NA,NA,NA
124,NA,NA,Editorial Material,2020,Strange Circulations: Affect and the Library Introduction,LIBRARY TRENDS,69,4,369-379,NA,NA,NA,NA,NA
125,NA,NA,Article,2013,The public academic library: friction in the teflon funnel,Library Juice Press,NA,NA,NA,NA,NA,NA,NA,NA
126,NA,NA,Article,2012,This is Not a Love Story: Libraries and Feminist Porn,NA,NA,NA,NA,NA,NA,NA,NA,NA
127,NA,NA,Conference Presentation,2013,Who Speaks for Libraries and Librarians,NA,NA,NA,NA,NA,NA,NA,NA,NA
128,10.53761/1.13.3.3,NA,NA,2016,Academic literacies as cornerstones in course design: A partnership to develop programming for faculty and teaching assistants,Journal of University Teaching & Learning Practice,13,3,3,NA,NA,NA,NA,NA
129,10.11645/11.2.2219,NA,NA,2017,Celebrating undergraduate students' research at York University: Information literacy competencies of high-achieving students.,Journal of Information Literacy,11,2,NA,NA,NA,NA,NA,NA
130,NA,NA,Conference Presentation,2009,Charting the course of information literacy with SAILS,NA,NA,NA,NA,NA,NA,NA,NA,NA
131,NA,NA,Conference Presentation,2006,"Charting the Course of Information Literacy with SAILS. Presented at Ontario Library Association (OLA) Super Conference, Toronto, Ontario, 2006.",NA,NA,NA,NA,NA,NA,NA,NA,NA
132,NA,NA,Report,2010,Continuing Professional Development and Irish Libraries: Report of Key Survey Findings. Executive Summary. January 2010,NA,NA,NA,NA,NA,NA,NA,NA,NA
133,10.1108/00907320710774346,NA,NA,2007,Corporate governance research on the free web: A selected annotated guide,Reference Services Review,35,3,497-514,NA,NA,NA,NA,NA
134,10.11645/5.1.1513,NA,Article,2011,"Faculty attitudes, perceptions and experiences of information literacy: a study across multiple disciplines at York University, Canada.",Journal of information literacy,5,1,45-64,NA,NA,NA,NA,NA
135,NA,NA,Conference Presentation,2011,Faculty Voices on Information Literacy,University of Regina Library,NA,NA,NA,NA,NA,NA,NA,NA
136,NA,NA,Conference Presentation,2009,Future Forward: Reflections on New and Emerging Service Directions in Canadian Academic Libraries.,NA,NA,NA,NA,NA,NA,NA,NA,NA
137,NA,NA,Article,2017,Global perspectives on information literacy: Fostering a dialogue for international understanding,Association of College and Research Libraries,NA,NA,NA,NA,NA,NA,NA,NA
138,NA,NA,Conference Presentation,2009,"Inside Out: Library Services At Point Of Need. Presented at Ontario Library Association (OLA) Super Conference, Toronto, Ontario, 2008.",NA,NA,NA,NA,NA,NA,NA,NA,NA
139,10.1108/RSR-11-2015-0048,NA,Article,2016,Learning from faculty voices on information literacy: Opportunities and challenges for undergraduate information literacy education,Reference Services Review,45,3,237-252,NA,NA,NA,NA,NA
140,NA,NA,Conference Presentation,2013,"Literacies—Information and beyond: The Learning Commons and the embedding of academic literacy instruction in disciplinary courses. Presented at WILU Conference, May 8-10 2013 …",NA,NA,NA,NA,NA,NA,NA,NA,NA
141,NA,NA,Conference Presentation,2018,Real or Fake? Helping York University Spot Fake News,NA,NA,NA,NA,NA,NA,NA,NA,NA
142,NA,NA,Conference Presentation,2014,"Teaching with SPARK. Co-presented with Ron Sheese (York University) at STHLE Conference 2014, Queen's University, Kingston, ON, June 2014.",NA,NA,NA,NA,NA,NA,NA,NA,NA
143,NA,NA,Article,2001,TECHNOFILE. TALKING THE TALK. You probably come across these techno terms every day. But do you know what they really mean?,APPLIED ARTS MAGAZINE,16,2,42-47,NA,NA,NA,NA,NA
144,NA,NA,Conference Presentation,2014,"Undergraduate Students' Writing, Research and Learning Skills: Academic Literacy Research and Practice at York University. Co-presented with Ron Sheese (York University) at TRY …",TRY Library Staff Conference,NA,NA,NA,NA,NA,NA,NA,NA
145,10.1108/00907320510581388,NA,Article,2005,Usability testing of an online information literacy tutorial,Emerald,33,1,54-65,NA,NA,NA,NA,NA
146,10.1108/07378831111138189,NA,Article,2011,Usability testing of VuFind at an academic library,Library Hi Tech,29,2,301-319,NA,NA,NA,NA,NA
147,10.5860/crl.79.7.931,NA,Article,2018,Academic Freedom and Librarians' Research and Scholarship in Canadian Universities,College & Research Libraries,79,7,931-947,NA,NA,NA,NA,NA
