pub_id,doi,isbn,doc_type,pub_year,title,source,volume,issue,pages,openalex_id,editor,location,edition,publisher
2697,NA,NA,NA,2020,Implementing an Assessment Program in Response to Stakeholder Need,NA,NA,NA,NA,NA,NA,NA,NA,NA
2698,NA,NA,NA,1995,Instructional development for distance education,Retrieved on June,NA,NA,NA,NA,NA,NA,NA,NA
2699,NA,NA,NA,2012,Interventions for the prevention of postoperative atrial fibrillation in adult patients undergoing noncardiac thoracic surgery,Cochrane Database of Systematic Reviews,NA,NA,NA,NA,NA,NA,NA,NA
2700,NA,NA,NA,2009,Introducing information literacy into anesthesia curricula,Canadian Journal of Anesthesia/Journal canadien d'anesthésie,NA,NA,NA,NA,NA,NA,NA,NA
2701,NA,NA,NA,2009,L'introduction de la maitrise de l'information dans les formations en anesthesie,Canadian Journal of Anesthesia,NA,NA,NA,NA,NA,NA,NA,NA
2702,NA,NA,NA,2016,New modalities to deliver surfactant in premature infants: a systematic review and meta-analysis,The Journal of Maternal-Fetal & Neonatal Medicine,5,1,NA,NA,NA,NA,NA,NA
2703,NA,NA,NA,2021,Pediatric and Adolescent Figure Skating Injuries: A 15-Year Retrospective Review,CLINICAL JOURNAL OF SPORT MEDICINE,NA,NA,NA,NA,NA,NA,NA,NA
2704,NA,NA,NA,2012,Silos and social identity: the social identity approach as a framework for understanding and overcoming divisions in health care,The Milbank Quarterly,NA,NA,NA,NA,NA,NA,NA,NA
2705,NA,NA,Review,2012,Silos and Social Identity: The Social Identity Approach as a Framework for Understanding and Overcoming Divisions in Health Care,Milbank Quarterly,3,NA,NA,NA,NA,NA,NA,NA
2706,NA,NA,NA,1996,Strategies for teaching at a distance,Distance Education at a Glance,NA,NA,NA,NA,NA,NA,NA,NA
2707,NA,NA,NA,2013,Subjects. Otolaryngology. Clinical.,University of Manitoba Libraries,NA,NA,NA,NA,NA,NA,NA,NA
2708,NA,NA,NA,1994,Teaching method and psychological type in bibliographic instruction: effect on student learning and confidence,RQ,NA,NA,NA,NA,NA,NA,NA,NA
2709,NA,NA,NA,2012,The incidence of malrotation after intramedullary nailing of femur fractures: a META-analysis,Orthopaedic Proceedings,NA,NA,NA,NA,NA,NA,NA,NA
2710,NA,NA,NA,2014,The internal validity of arthroscopic simulators and their effectiveness in arthroscopic education,"Knee Surgery, Sports Traumatology, Arthroscopy",33,2,131-142,NA,NA,NA,NA,NA
2711,NA,NA,NA,2012,The medical student’s Toolkit,Medical Education,NA,NA,NA,NA,NA,NA,NA,NA
2712,NA,NA,NA,2018,THU0582 A systematic review of employment outcomes of adults with childhood-onset systemic autoimmune rheumatic diseases,Annals of the Rheumatic Diseases,NA,NA,NA,NA,NA,NA,NA,NA
2713,NA,NA,NA,NA,What problems were addressed? In the absence of,NA,NA,NA,NA,NA,NA,NA,NA,NA
2714,NA,NA,NA,2015,Where Do We Grow From Here? An Evaluation of Library Services to a Provincial Health Authority,NA,NA,NA,NA,NA,NA,NA,NA,NA
2715,NA,NA,NA,1989,A guide to In Vitro Fertilization and Other Assisted Reproductive Methods by Arthur L. Wisot,University of Calgary,NA,NA,NA,NA,NA,NA,NA,NA
2716,NA,NA,NA,1991,AIDS and Ethics by Frederic G. Reamer,University of Calgary,NA,NA,NA,NA,NA,NA,NA,NA
2717,NA,NA,NA,1996,Atlas historique du quebec: Le pays laurentian au XIXe siecle: Les morphologies de base,Cartographica,NA,NA,NA,NA,NA,NA,NA,NA
2718,NA,NA,NA,1996,Atlas historique du Quebec: le pays Laurentian au XIXe siecle: les morphologies de base,Cartographica,NA,NA,NA,NA,NA,NA,NA,NA
2719,NA,NA,NA,1993,Beaverbrook: A Life by Anne Chisholm and Michael Davie,University of Calgary,NA,NA,NA,NA,NA,NA,NA,NA
2720,NA,NA,NA,1989,"Black Women in White: Racial Conflict and Cooperation in the Nursing Profession, 1890-1950 by Darlene Clark Hine",University of Calgary,NA,NA,NA,NA,NA,NA,NA,NA
2721,NA,NA,NA,1992,British Naval Race a Satisfying Read,Calgary Herald,NA,NA,NA,NA,NA,NA,NA,NA
2722,NA,NA,NA,1997,Cafe Europa: Life After Communism by Slavenka Drakulic,University of Calgary,NA,NA,NA,NA,NA,NA,NA,NA
2723,NA,NA,NA,2021,Canadian Law Library Review,Canadian Law Library Review,NA,NA,NA,NA,NA,NA,NA,NA
2724,NA,NA,NA,2008,"Changing Role of Women in Science Fiction: Weird Tales, 1925-1940",McFarland Press,NA,NA,NA,NA,NA,NA,NA,NA
2725,NA,NA,NA,2006,Comic Side of Collections: The Morley Donation,University of Calgary,NA,NA,NA,NA,NA,NA,NA,NA
2726,NA,NA,NA,1990,Contraception: A Guide to Birth Control Methods by Vern L. Bullough and Bonnie Bullough,University of Calgary,NA,NA,NA,NA,NA,NA,NA,NA
2727,NA,NA,NA,2010,Controlling the Popular: Canadian Memory Institutions and Popular Culture,Athabasca University,NA,NA,NA,NA,NA,NA,NA,NA
2728,NA,NA,NA,1998,Cyberlan: What You Need to Know About Doing Business Online,CANADIAN LAW LIBRARIES,NA,NA,NA,NA,NA,NA,NA,NA
2729,NA,NA,NA,1990,"Dictionary of Canadian Biography, 1891-1900 edited by Francess G. Halpenny.",University of Calgary,NA,NA,NA,NA,NA,NA,NA,NA
2730,NA,NA,NA,1991,Did Yamamoto Order Poisoning?,University of Calgary,NA,NA,NA,NA,NA,NA,NA,NA
2731,NA,NA,NA,1993,Doctors and The Law: Medical Jurisprudence in Nineteenth Century America by James C. Mohr,University of Calgary,NA,NA,NA,NA,NA,NA,NA,NA
2732,NA,NA,NA,1989,Emergency! by Saundra Shohen and Ann Loring,University of Calgary,NA,NA,NA,NA,NA,NA,NA,NA
2733,NA,NA,NA,1992,Fenian Raids Helped Boost Canadian Military and Unity: Final Edition,Calgary Herald,NA,NA,NA,NA,NA,NA,NA,NA
2734,NA,NA,NA,1997,Forced Exit: The Slippery Slope from Assisted Suicide to Legalized Murder by Wesley J. Smith.,University of Calgary,NA,NA,NA,NA,NA,NA,NA,NA
2735,NA,NA,NA,1991,"Having Twins: A Parents Guide to Pregnancy, Birth and Early Childhood by Elizabeth Noble and Leo Sorger",University of Calgary,NA,NA,NA,NA,NA,NA,NA,NA
2736,NA,NA,NA,1991,"History of Childbirth: Fertility, Pregnancy and Birth in Early Modern Europe by Jacques Gelis",University of Calgary,NA,NA,NA,NA,NA,NA,NA,NA
2737,NA,NA,NA,1989,How to Choose the Sex of Your Baby: The Newly Revised Edition of the Method Best Supported by Scientific Evidence by Landrum B. Shettles and David M. Rorvik,University of Calgary,NA,NA,NA,NA,NA,NA,NA,NA
2738,NA,NA,NA,1990,In Pursuit of Fertility: A Consultation with a Specialist by Robert R. Franklin and Dorothy Kay Brockman.,University of Calgary,NA,NA,NA,NA,NA,NA,NA,NA
2739,NA,NA,NA,1989,Just a Nurse: The Lives and Experiences of Nurses in America--In Their Own Words by Janet Kraegel and Mary Kachoyeanos,University of Calgary,NA,NA,NA,NA,NA,NA,NA,NA
2740,NA,NA,NA,1990,Lactation Consultant's Topical Review and Bibliography of the Literature on Breastfeeding edited by Mary-Margaret Coates,University of Calgary,NA,NA,NA,NA,NA,NA,NA,NA
2741,NA,NA,NA,2007,Law and Morality: Reading in Legal Philosophy,CANADIAN LAW LIBRARY REVIEW,NA,NA,NA,NA,NA,NA,NA,NA
2742,NA,NA,NA,1995,Library Information Technology and Networks by Audrey N. Grosch,University of Calgary,NA,NA,NA,NA,NA,NA,NA,NA
2743,NA,NA,NA,2014,Make ‘em Laugh: Images of Law in Eighteenth Century Popular Culture,"Law, Culture and Visual Studies",NA,NA,NA,NA,NA,NA,NA,NA
2744,NA,NA,NA,1992,Marketplace Medicine: The Rise of the For-Profit Hospital Chains by James Lindorff,University of Calgary,NA,NA,NA,NA,NA,NA,NA,NA
2745,NA,NA,NA,1997,Mortal Peril: Out Inalienable Right to Health Care?,University of Calgary,NA,NA,NA,NA,NA,NA,NA,NA
2746,NA,NA,NA,1997,New Automation Technology for Acquisitions and Collection Development by Rosann Basirjian,University of Calgary,NA,NA,NA,NA,NA,NA,NA,NA
2747,NA,NA,NA,1990,New Options for Fertility: A Guide to In Vitro Fertilization and Other Assisted Reproduction Methods by Arthur L. Wisot.,University of Calgary,NA,NA,NA,NA,NA,NA,NA,NA
2748,NA,NA,NA,1990,One Children's Place: A Profile of Pediatric Medicine by Lee Gutkind,University of Calgary,NA,NA,NA,NA,NA,NA,NA,NA
2749,NA,NA,NA,1989,"Online Search Services in the Academic Library: Planning, Management and Operation by Janice F. Sieburth",University of Calgary,NA,NA,NA,NA,NA,NA,NA,NA
2750,NA,NA,NA,2002,Oxford Reference Online,University of Calgary,NA,NA,NA,NA,NA,NA,NA,NA
2751,NA,NA,NA,1989,Parenting Your Premature Baby by Janine Jason and Antonia van der Meer,University of Calgary,NA,NA,NA,NA,NA,NA,NA,NA
2752,NA,NA,NA,1997,Physician-Assisted Suicide by Robert F. Weir,University of Calgary,NA,NA,NA,NA,NA,NA,NA,NA
2753,NA,NA,NA,1993,Poland Struggling Still for Justice and Values,Calgary Herald,NA,NA,NA,NA,NA,NA,NA,NA
2754,NA,NA,NA,2021,Revue canadienne des bibliothèques de droit,Revue canadienne des bibliothèques de droit,NA,NA,NA,NA,NA,NA,NA,NA
2755,NA,NA,NA,1997,Statuatory Interpretation,CANADIAN LAW LIBRARIES,NA,NA,NA,NA,NA,NA,NA,NA
2756,NA,NA,NA,1997,"Technical Services Management, 1965-1990: A Quarter Century of Change and a Look to the Future by Linda C, Smith and Ruth C. Carter",University of Calgary,NA,NA,NA,NA,NA,NA,NA,NA
2757,NA,NA,NA,1990,The Baby Challenge: A Handbook on Pregnancy for Women with a Physical Disability by Mukti Jain Campion.,University of Calgary,NA,NA,NA,NA,NA,NA,NA,NA
2758,NA,NA,NA,1990,The Boy Who Felt No Pain: Tales from the Pediatric Ward by Robert Marion.,University of Calgary,NA,NA,NA,NA,NA,NA,NA,NA
2759,NA,NA,NA,2008,"The Changing Role of Women in Science Fiction: Weird Tales,¡ 925–¡ 940",The Influence of Imagination: Essays on Science Fiction and Fantasy as …,NA,NA,NA,NA,NA,NA,NA,NA
2760,NA,NA,NA,2004,The Corporate Counsel Guide to Employment law by Peter Wilson and Allison Taylor,University of Calgary,NA,NA,NA,NA,NA,NA,NA,NA
2761,NA,NA,NA,1997,"The corpse: A history-Quigley, C",LIBRARY JOURNAL,NA,NA,NA,NA,NA,NA,NA,NA
2762,NA,NA,NA,1997,The Corpse: A History by Christine Quigley,University of Calgary,NA,NA,NA,NA,NA,NA,NA,NA
2763,NA,NA,NA,1989,The Couple's Guide to Fertility by Gary S. Berger and others,University of Calgary,NA,NA,NA,NA,NA,NA,NA,NA
2764,NA,NA,NA,1997,The Future of Resource Sharing,CANADIAN LAW LIBRARIES,NA,NA,NA,NA,NA,NA,NA,NA
2765,NA,NA,NA,2008,The globalized rule of law: relationships between international and domestic law,University of Calgary,NA,NA,NA,NA,NA,NA,NA,NA
2766,NA,NA,NA,1997,The Law School Book: Succeeding at Law School,CANADIAN LAW LIBRARIES,NA,NA,NA,NA,NA,NA,NA,NA
2767,NA,NA,NA,1989,The Pasteurization of France by Bruno Latour and translated by Alan Sheridan and John Law,University of Calgary,NA,NA,NA,NA,NA,NA,NA,NA
2768,NA,NA,NA,1990,Walking the Line: Travels Along the Canadian/American Border by Marian Botsford Fraser,University of Calgary,NA,NA,NA,NA,NA,NA,NA,NA
2769,NA,NA,NA,1996,"Wetlands: The web of life-Rezendes, P, Roy, P",LIBRARY JOURNAL,NA,NA,NA,NA,NA,NA,NA,NA
2770,NA,NA,NA,1992,Women Under the Knife: A History of Surgery by Ann Dally,University of Calgary,NA,NA,NA,NA,NA,NA,NA,NA
2771,https://doi.org/10.1002/jccs.201700095,NA,journal-article,2018,"An Efficient Synthesis of 1,3‐Diphenyl‐3‐phenylamino‐propan‐1‐one and its Derivatives by Mannich Reaction in the Presence of Doped Porous Carbon by Nitrogen and Sulfur (NS‐PCS) as Catalyst",Journal of The Chinese Chemical Society,65,5,548-553,https://openalex.org/W2777281502,NA,NA,NA,NA
2772,https://doi.org/10.1080/10406638.2018.1557705,NA,journal-article,2020,Synthesis and Characterization of Betti Bases Derivatives via Green Mannich Reaction by NS-PCS and FHS as the Catalyst,Polycyclic Aromatic Compounds,40,5,1470-1478,https://openalex.org/W2912687065,NA,NA,NA,NA
2773,NA,NA,Article,2014,Putting a Sacred Cow Out to Pasture: Assessing the Removal of Fines and Reduction of Barriers at a Small Academic Library,Journal of Academic Librarianship,33,2,131-142,NA,NA,NA,NA,NA
2774,NA,NA,NA,2000,[Review of the book Free the children!: Conflict education for strong and peaceful minds],The Bookmark,NA,NA,NA,NA,NA,NA,NA,NA
2775,NA,NA,NA,2002,“Plug and Play” in Context: Reflections on a Distance Information Literacy Unit,Journal of Business & Finance Librarianship,NA,NA,NA,NA,NA,NA,NA,NA
2776,NA,NA,NA,2019,BC Digital Library initiative: Radical collaboration toward community infrastructure for Open Access,BC Digital Library,NA,NA,NA,NA,NA,NA,NA,NA
2777,NA,NA,NA,2016,Cloud is Calling–Or is it Zombies of Death?,BCNet,NA,NA,NA,NA,NA,NA,NA,NA
2778,NA,NA,NA,2013,"Culling the Herd in Hard Times: Implementing an Evidence-Based"" Big Deal"" Cancellation Support Tool at Vancouver Island University Library",NA,NA,NA,NA,NA,NA,NA,NA,NA
2779,NA,NA,NA,2015,Dashboard metrics for scholarly activity at a small university: Open vs.‘freemium’vs. premium,NA,NA,NA,NA,NA,NA,NA,NA,NA
2780,NA,NA,NA,2006,Designing library services for the PDA,Journal of library administration,NA,NA,NA,NA,NA,NA,NA,NA
2781,NA,NA,NA,2012,Free Range Library: Information Literacy Outcomes Come Home to Roost,NA,NA,NA,NA,NA,NA,NA,NA,NA
2782,NA,NA,NA,1990,"Indian reserve cut-offs in British Columbia, 1912-1924: an examination of federal-provincial negotiations and consultation with Indians",University of British Columbia,NA,NA,NA,NA,NA,NA,NA,NA
2783,NA,NA,NA,2007,Information Management at the HTG,First Nations Technology Conference:,NA,NA,NA,NA,NA,NA,NA,NA
2784,NA,NA,NA,2002,Knowledge Management,Canadian Association of Law Libraries (CALL/ABCD): Traditions for Tomorrow,NA,NA,NA,NA,NA,NA,NA,NA
2785,NA,NA,NA,1996,Literature of World War One for Young Adults,NA,NA,NA,NA,NA,NA,NA,NA,NA
2786,NA,NA,NA,1996,Multimedia in higher education,The Katherine Sharp Review,NA,NA,NA,NA,NA,NA,NA,NA
2787,NA,NA,NA,2002,Reflections on a Distance Information Literacy Unit,Library Services for Business Students in Distance Education: Issues and …,NA,NA,NA,NA,NA,NA,NA,NA
2788,NA,NA,NA,2012,"Sit, watch, listen: Collaboratively creating Indigenous knowledge protocols",Electronic version published by Vancouver Island University,NA,NA,NA,NA,NA,NA,NA,NA
2789,NA,NA,NA,2019,The BC Digital Library initiative: Radical collaboration toward community infrastructure for Open Access,NA,NA,NA,NA,NA,NA,NA,NA,NA
2790,NA,NA,NA,2016,"Transforming Technical Services, Opening Knowledge for the Community: A VIU Technical Services Sixer",NA,NA,NA,NA,NA,NA,NA,NA,NA
2791,NA,NA,NA,2017,"Using baskets and a rubric to assess online resources in the"" messy middle""",ACRL,NA,NA,NA,NA,NA,NA,NA,NA
2792,NA,NA,NA,2007,Using virtual classroom software for library instruction,Going the distance: library instruction for remote learners,NA,NA,NA,NA,NA,NA,NA,NA
2793,NA,NA,NA,2014,Vancouver Island University Library Marks Welcomes and Departures,BCLA Browser: Linking the Library Landscape,NA,NA,NA,NA,NA,NA,NA,NA
2794,NA,NA,NA,2012,VIUSpace: Introducing the Library's Showcase for Selected VIU Scholarship & Special Collections,Electronic version published by Vancouver Island University,NA,NA,NA,NA,NA,NA,NA,NA
2795,NA,NA,NA,2014,Awareness of open access issues differs among faculty at institutions of different sizes,Evidence Based Library and Information Practice,NA,NA,NA,NA,NA,NA,NA,NA
2796,NA,NA,NA,2013,"Culling the Herd in Hard Times: Implementing an Evidence-Based"" Big Deal"" Cancellation Support Tool at Vancouver Island University Library",Evidence Based Library and Information Practice (EBLIP),NA,NA,NA,NA,NA,NA,NA,NA
2797,NA,NA,NA,2014,Development of Deal-and Journal-level Metrics and Methods Assists Librarians to Evaluate Big Deals,Evidence Based Library and Information Practice,NA,NA,NA,NA,NA,NA,NA,NA
2798,NA,NA,NA,2016,Dynamic duos: Blended instruction and faculty-librarian collaboration,ACRL,NA,NA,NA,NA,NA,NA,NA,NA
2799,NA,NA,NA,2021,Evidence Brief: Youth and Public Transit,NA,NA,NA,NA,NA,NA,NA,NA,NA
2800,NA,NA,NA,2013,Follow-Up Study on Free Document Delivery and Interlibrary Loan Service Demonstrates Customer Satisfaction and Generates Improvements,Evidence Based Library and Information Practice,NA,NA,NA,NA,NA,NA,NA,NA
2801,NA,NA,NA,2021,Free and Reduced-fare Public Transit for Youth (Evidence Brief),NA,NA,NA,NA,NA,NA,NA,NA,NA
2802,NA,NA,NA,2021,Free and Reduced-Fare Transportation for Youth,NA,NA,NA,NA,NA,NA,NA,NA,NA
2803,NA,NA,NA,2011,Gracious space: Library programming strategies towards immigrants as tools in the creation of social capital..... 5,Library & Information Science Research,NA,NA,NA,NA,NA,NA,NA,NA
2804,NA,NA,NA,2010,"Information hippies, Google-fu masters, and other volunteer tourists in Thailand: information behaviour in the liminoid",NA,NA,NA,NA,NA,NA,NA,NA,NA
2805,NA,NA,dissertation-thesis,NA,"Information Hippies, Google-Fu Masters, and Other Volunteer Tourists in Thailand: Information Behaviour in the Liminoid",NA,NA,NA,NA,NA,NA,NA,NA,NA
2806,NA,NA,NA,2012,"Information Hippies, Google-Fu Masters, and Other Volunteer Tourists in Thailand: Information Behaviour of'Culture-Shocked'Individuals",University of Alberta,NA,NA,NA,NA,NA,NA,NA,NA
2807,NA,NA,NA,2015,Interrogating impact: Altmetrics as indicators of influence in & beyond the academy,NA,NA,NA,NA,NA,NA,NA,NA,NA
2808,NA,NA,NA,2017,Interview to the double: Uncovering student motivations in the library,ACRL,NA,NA,NA,NA,NA,NA,NA,NA
2809,NA,NA,journal-article,2016,Laying the groundwork for a new library service: Scholar-practitioner & graduate student attitudes toward altmetrics and the curation of online profiles,Evidence Based Library and Information Practice,NA,NA,NA,NA,NA,NA,NA,NA
2810,NA,NA,NA,2012,Library Survey 2012-Preliminary Results,NA,NA,NA,NA,NA,NA,NA,NA,NA
2811,NA,NA,NA,2013,Link Established Between LBGT-Friendly Campus Climate Index Scores and Web-Based Resources of Academic Libraries,Evidence Based Library and Information Practice,NA,NA,NA,NA,NA,NA,NA,NA
2812,NA,NA,journal-article,2015,Mixed-Method Survey Research is Useful to Incrementally Improve Library Homepage Design,Evidence Based Library and Information Practice,NA,NA,NA,NA,NA,NA,NA,NA
2813,NA,NA,journal-article,2016,"Obtaining Journal Titles via Big Deals Most Cost Effective Compared to Individual Subscriptions, Pay-Per-View, and Interlibrary Loan",Evidence Based Library and Information Practice,NA,NA,NA,NA,NA,NA,NA,NA
2814,NA,NA,NA,2014,Putting a sacred cow out to pasture: Assessing the removal of fines and reduction of barriers at a small academic library,The Journal of academic librarianship,NA,NA,NA,NA,NA,NA,NA,NA
2815,NA,NA,NA,2015,Scholarly Communication Apprenticeship as a Site of Information Literacy Development for Humanities Undergraduates,Association of College & Research Libraries (ACRL),NA,NA,NA,NA,NA,NA,NA,NA
2816,NA,NA,NA,2010,Shortcuts and Dead Ends: Control Issues with Online User-Generated Content,Proceedings of the Annual Conference of CAIS/Actes du congrès annuel de l'ACSI,NA,NA,NA,NA,NA,NA,NA,NA
2817,NA,NA,NA,2017,Stories from the Mount Arrowsmith Biosphere Region,Electronic version published by Vancouver Island University,NA,NA,NA,NA,NA,NA,NA,NA
2818,NA,NA,NA,NA,Tag Archives: librarian as researcher,NA,NA,NA,NA,NA,NA,NA,NA,NA
2819,NA,NA,journal-article,2020,Talking back: trans youth and resilience in action,Journal of LGBT Youth,NA,NA,NA,NA,NA,NA,NA,NA
2820,NA,NA,NA,2009,The social construction of volunteer non‐governmental organization worker identities: Preliminary analysis of effects and implications for information behaviors,Proceedings of the American Society for Information Science and Technology …,NA,NA,NA,NA,NA,NA,NA,NA
2821,NA,NA,NA,2022,"Transportation Planning, Policy, and Electric Micro-Mobilities: A Knowledge Synthesis of Recent Publications",NA,NA,NA,NA,NA,NA,NA,NA,NA
2822,10.1016/j.lisr.2010.07.014,NA,Article,2011,"Trends in information behavior research, 1999-2008: A content analysis",LIBRARY & INFORMATION SCIENCE RESEARCH,NA,NA,NA,NA,NA,NA,NA,NA
2823,NA,NA,NA,2016,Users Engage More with Interface than Materials at Welsh Newspapers Online Website,Evidence Based Library and Information Practice,NA,NA,NA,NA,NA,NA,NA,NA
2824,NA,NA,NA,NA,"When Only Boolean Knowledge Can Save the World from Alien Invaders: The Planning and Implementation of “Invasion of the And-Ors”, a Flash-based Boolean Search Tutorial",NA,NA,NA,NA,NA,NA,NA,NA,NA
2825,NA,NA,NA,2017,"Without Library Resources and Services, the Scholarly Activity of Medical Faculty and Residents Would Register a Code Blue",Evidence Based Library and Information Practice,NA,NA,NA,NA,NA,NA,NA,NA
2826,NA,NA,NA,2021,Youth and Public Transit (Evidence Brief),NA,NA,NA,NA,NA,NA,NA,NA,NA
2827,NA,NA,NA,2021,Youth and Public Transit: A Knowledge Synthesis of Recent Publications,NA,NA,NA,NA,NA,NA,NA,NA,NA
2828,NA,NA,NA,NA,GRADUATE TRANSITIONS TO THE LITERATURE REVIEW,NA,NA,NA,NA,NA,NA,NA,NA,NA
2829,NA,NA,NA,2020,Graduate Transitions: Canadian Master's and PhD Writing Experiences,Discourse and Writing/Rédactologie,30,NA,264-289,NA,NA,NA,NA,NA
2830,NA,NA,Review,2016,Non-pharmacological cancer pain interventions in populations with social disparities: a systematic review and meta-analysis,Supportive Care in Cancer,33,44563,39-65,NA,NA,NA,NA,NA
2831,NA,NA,NA,2018,Non-pharmacological cancer pain interventions in populations with social disparities: A systematic review and meta-analysis,NA,NA,NA,NA,NA,NA,NA,NA,NA
2832,https://doi.org/10.1007/s00520-015-2998-9,NA,journal-article,2016,Non-pharmacological cancer pain interventions in populations with social disparities: a systematic review and meta-analysis.,Supportive Care in Cancer,24,2,985-1000,https://openalex.org/W2112168029,NA,NA,NA,NA
2833,NA,NA,NA,2014,Noni is Nervous by H. Hartt-Sussman (2nd review),The Deakin Review of Children's Literature,NA,NA,NA,NA,NA,NA,NA,NA
2834,https://doi.org/10.20361/g2tw2t,NA,journal-article,2014,Noni is Nervous by H. Hartt-Sussman (2nd review),ACM Sigmod Digital Review,4,2,NA,https://openalex.org/W617362632,NA,NA,NA,NA
2835,NA,NA,NA,2020,Writing the literature review: graduate student experiences,The Canadian Journal for the Scholarship of Teaching and Learning,NA,1,1-17,NA,NA,NA,NA,NA
2836,https://doi.org/10.1016/j.funbio.2011.10.005,NA,journal-article,2012,Identification of group I introns within the SSU rDNA gene in species of Ceratocystiopsis and related taxa.,Fungal Biology,116,1,98-111,https://openalex.org/W2080421443,NA,NA,NA,NA
2837,NA,NA,NA,2021,A User-Centric Case for Rights Reversions and Other Mitigations: The Cultural Capital Project Submission to ISED Consultation on Term Extension,NA,NA,NA,NA,NA,NA,NA,NA,NA
2838,NA,NA,NA,2020,Assessing a Journal Publisher,University of Winnipeg,NA,NA,NA,NA,NA,NA,NA,NA
2839,NA,NA,NA,2021,Canadian Collaborations: Library Communications and Advocacy in the time COVID-19,Journal of Copyright in Education & Librarianship,NA,NA,NA,NA,NA,NA,NA,NA
2840,NA,NA,NA,2021,Developing Criteria to Prioritize Rapid Removal of American Elm Trees Infected with Dutch Elm Disease,University of Winnipeg,NA,NA,NA,NA,NA,NA,NA,NA
2841,NA,NA,NA,2022,Independent Canadian Music in the Streaming Age: The Sound from above (Critical Political Economy) and below (Ethnography of Musicians),Popular Music and Society,NA,NA,NA,NA,NA,NA,NA,NA
2842,NA,NA,NA,2019,Millennium for all alternative report on public library security,LIS Scholarship Archive (LISSA),NA,NA,NA,NA,NA,NA,NA,NA
2843,NA,NA,NA,2020,Publication Considerations,University of Winnipeg,NA,NA,NA,NA,NA,NA,NA,NA
2844,NA,NA,NA,2015,Publishing to WinnSpace,University of Winnipeg Library,NA,NA,NA,NA,NA,NA,NA,NA
2845,NA,NA,NA,2018,Putting Users and Small-Scale Creators First in Canadian Copyright Law and Beyond: A Brief submitted to INDU Statutory Review of the Copyright Act,NA,NA,NA,NA,NA,NA,NA,NA,NA
2846,NA,NA,NA,2018,Putting Users and Small-Scale Creators First in Canadian Copyright Law and Beyond: A Brief Submitted To The Standing Committee on Canadian Heritage Remuneration Models for …,University of Winnipeg Library,NA,NA,NA,NA,NA,NA,NA,NA
2847,NA,NA,NA,2018,Recommandations pour un Service dataverse national,NA,NA,NA,NA,NA,NA,NA,NA,NA
2848,NA,NA,NA,2018,Recommendations for a National Dataverse Service,NA,NA,NA,NA,NA,NA,NA,NA,NA
2849,NA,NA,NA,2019,Special Focus on Research and Scholarship,Canadian Journal of Academic Librarianship,NA,NA,NA,NA,NA,NA,NA,NA
2850,NA,NA,NA,NA,The CUSMA Term Extension: Policy Options and Library Advocacy as We Reckon with Prospect of a 20 year Freeze on New Works Entering the Canadian Public Domain,NA,NA,NA,NA,NA,NA,NA,NA,NA
2851,NA,NA,NA,2019,"Winnipeg’s Millennium Library Needs Solidarity, Not Security",Partnership: The Canadian Journal of Library and Information Practice and …,NA,NA,NA,NA,NA,NA,NA,NA
2852,https://doi.org/10.1016/j.nbd.2011.06.014,NA,journal-article,2012,Abnormal prostaglandin E2 production blocks myogenic differentiation in myotonic dystrophy,Neurobiology of Disease,45,1,122-129,https://openalex.org/W1967671894,NA,NA,NA,NA
2853,https://doi.org/10.1016/j.nbd.2009.07.009,NA,journal-article,2009,Absence of a differentiation defect in muscle satellite cells from DM2 patients,Neurobiology of Disease,36,1,181-190,https://openalex.org/W1996064016,NA,NA,NA,NA
2854,https://doi.org/10.1016/0969-806x(93)90246-q,NA,journal-article,1993,Economics of food irradiation,Radiation Physics and Chemistry,42,NA,259-268,https://openalex.org/W2088320225,NA,NA,NA,NA
2855,NA,NA,NA,2006,Inhibition de la différenciation myogénique par un facteur soluble sécrété par des myoblastes dérivés de muscules squelettiques de sujets atteints de la dystrophie myotonique de type 1,NA,NA,NA,NA,https://openalex.org/W2888762090,NA,NA,NA,NA
2856,NA,NA,Article,2015,Using and Experiencing the Academic Library: A Multisite Observational Study of Space and Place,College & Research Libraries,33,44563,39-65,NA,NA,NA,NA,NA
2857,NA,NA,Article,2018,The Changing Research Data Landscape and the Experiences of Ethics Review Board Chairs: Implications for Library Practice and Partnerships,Journal of Academic Librarianship,41,6,1379-1386,NA,NA,NA,NA,NA
2858,NA,NA,NA,2014,A study of students' perceptions of library catalogues on tablet computers: The NEOS Consortium catalogue,Forum for Information Professionals,NA,NA,NA,NA,NA,NA,NA,NA
2859,NA,NA,NA,2016,Alberta OER Toolkits,OER In and Across Disciplines Conference (Mount Royal University),NA,NA,NA,NA,NA,NA,NA,NA
